<?xml version="1.0" encoding="UTF-8" standalone="yes"?><gameSchedulesFeed><season>2015</season><gameSchedules><gameSchedule season="2015" seasonType="PRE" week="0" gameId="2015080951" gameKey="56759" gameDate="08/09/2015" gameTimeEastern="20:00:00" gameTimeLocal="20:00:00" isoTime="2015-08-09T17:00:00-07:00" homeTeamId="3000" visitorTeamId="3900" homeTeamAbbr="MIN" visitorTeamAbbr="PIT" homeDisplayName="Minnesota Vikings" visitorDisplayName="Pittsburgh Steelers" homeNickname="Vikings" visitorNickname="Steelers" gameType="PRE" weekNameAbbr="HOF" weekName="Hall of Fame Week"><visitorTeam season="2015" teamId="3900" abbr="PIT" cityState="Pittsburgh" fullName="Pittsburgh Steelers" nick="Steelers" teamType="TEAM" conferenceAbbr="AFC" divisionAbbr="ACN"/><homeTeam season="2015" teamId="3000" abbr="MIN" cityState="Minnesota" fullName="Minnesota Vikings" nick="Vikings" teamType="TEAM" conferenceAbbr="NFC" divisionAbbr="NCN"/><site siteId="1900" siteCity="Canton" siteState="OH" siteFullname="Tom Benson Hall of Fame Stadium" roofType="OUTDOOR"/><networkChannel>NBC</networkChannel></gameSchedule><gameSchedule season="2015" seasonType="PRE" week="1" gameId="2015081351" gameKey="56760" gameDate="08/13/2015" gameTimeEastern="19:30:00" gameTimeLocal="19:30:00" isoTime="2015-08-13T16:30:00-07:00" homeTeamId="0325" visitorTeamId="3300" homeTeamAbbr="BAL" visitorTeamAbbr="NO" homeDisplayName="Baltimore Ravens" visitorDisplayName="New Orleans Saints" homeNickname="Ravens" visitorNickname="Saints" gameType="PRE" weekNameAbbr="P1" weekName="Preseason Week 1"><visitorTeam season="2015" teamId="3300" abbr="NO" cityState="New Orleans" fullName="New Orleans Saints" nick="Saints" teamType="TEAM" conferenceAbbr="NFC" divisionAbbr="NCS"/><homeTeam season="2015" teamId="0325" abbr="BAL" cityState="Baltimore" fullName="Baltimore Ravens" nick="Ravens" teamType="TEAM" conferenceAbbr="AFC" divisionAbbr="ACN"/><site siteId="3695" siteCity="Baltimore" siteState="MD" siteFullname="M&amp;T Bank Stadium" roofType="OUTDOOR"/></gameSchedule><gameSchedule season="2015" seasonType="PRE" week="1" gameId="2015081352" gameKey="56761" gameDate="08/13/2015" gameTimeEastern="19:30:00" gameTimeLocal="19:30:00" isoTime="2015-08-13T16:30:00-07:00" homeTeamId="1540" visitorTeamId="3430" homeTeamAbbr="DET" visitorTeamAbbr="NYJ" homeDisplayName="Detroit Lions" visitorDisplayName="New York Jets" homeNickname="Lions" visitorNickname="Jets" gameType="PRE" weekNameAbbr="P1" weekName="Preseason Week 1"><visitorTeam season="2015" teamId="3430" abbr="NYJ" cityState="New York Jets" fullName="New York Jets" nick="Jets" teamType="TEAM" conferenceAbbr="AFC" divisionAbbr="ACE"/><homeTeam season="2015" teamId="1540" abbr="DET" cityState="Detroit" fullName="Detroit Lions" nick="Lions" teamType="TEAM" conferenceAbbr="NFC" divisionAbbr="NCN"/><site siteId="2026" siteCity="Detroit" siteState="MI" siteFullname="Ford Field" roofType="INDOOR"/></gameSchedule><gameSchedule season="2015" seasonType="PRE" week="1" gameId="2015081353" gameKey="56762" gameDate="08/13/2015" gameTimeEastern="19:30:00" gameTimeLocal="19:30:00" isoTime="2015-08-13T16:30:00-07:00" homeTeamId="3200" visitorTeamId="1800" homeTeamAbbr="NE" visitorTeamAbbr="GB" homeDisplayName="New England Patriots" visitorDisplayName="Green Bay Packers" homeNickname="Patriots" visitorNickname="Packers" gameType="PRE" weekNameAbbr="P1" weekName="Preseason Week 1"><visitorTeam season="2015" teamId="1800" abbr="GB" cityState="Green Bay" fullName="Green Bay Packers" nick="Packers" teamType="TEAM" conferenceAbbr="NFC" divisionAbbr="NCN"/><homeTeam season="2015" teamId="3200" abbr="NE" cityState="New England" fullName="New England Patriots" nick="Patriots" teamType="TEAM" conferenceAbbr="AFC" divisionAbbr="ACE"/><site siteId="1065" siteCity="Foxborough" siteState="MA" siteFullname="Gillette Stadium" roofType="OUTDOOR"/><localHomeTv>WBZ / Patriots Preseason Network</localHomeTv><localHomeRadio>98.5 FM The Sports Hub</localHomeRadio></gameSchedule><gameSchedule season="2015" seasonType="PRE" week="1" gameId="2015081354" gameKey="56763" gameDate="08/13/2015" gameTimeEastern="20:00:00" gameTimeLocal="20:00:00" isoTime="2015-08-13T17:00:00-07:00" homeTeamId="1050" visitorTeamId="5110" homeTeamAbbr="CLE" visitorTeamAbbr="WAS" homeDisplayName="Cleveland Browns" visitorDisplayName="Washington Redskins" homeNickname="Browns" visitorNickname="Redskins" gameType="PRE" weekNameAbbr="P1" weekName="Preseason Week 1"><visitorTeam season="2015" teamId="5110" abbr="WAS" cityState="Washington" fullName="Washington Redskins" nick="Redskins" teamType="TEAM" conferenceAbbr="NFC" divisionAbbr="NCE"/><homeTeam season="2015" teamId="1050" abbr="CLE" cityState="Cleveland" fullName="Cleveland Browns" nick="Browns" teamType="TEAM" conferenceAbbr="AFC" divisionAbbr="ACN"/><site siteId="1048" siteCity="Cleveland" siteState="OH" siteFullname="FirstEnergy Stadium" roofType="OUTDOOR"/></gameSchedule><gameSchedule season="2015" seasonType="PRE" week="1" gameId="2015081355" gameKey="56764" gameDate="08/13/2015" gameTimeEastern="20:00:00" gameTimeLocal="19:00:00" isoTime="2015-08-13T17:00:00-07:00" homeTeamId="0810" visitorTeamId="2700" homeTeamAbbr="CHI" visitorTeamAbbr="MIA" homeDisplayName="Chicago Bears" visitorDisplayName="Miami Dolphins" homeNickname="Bears" visitorNickname="Dolphins" gameType="PRE" weekNameAbbr="P1" weekName="Preseason Week 1"><visitorTeam season="2015" teamId="2700" abbr="MIA" cityState="Miami" fullName="Miami Dolphins" nick="Dolphins" teamType="TEAM" conferenceAbbr="AFC" divisionAbbr="ACE"/><homeTeam season="2015" teamId="0810" abbr="CHI" cityState="Chicago" fullName="Chicago Bears" nick="Bears" teamType="TEAM" conferenceAbbr="NFC" divisionAbbr="NCN"/><site siteId="4620" siteCity="Chicago" siteState="IL" siteFullname="Soldier Field" roofType="OUTDOOR"/><localHomeTv>FOX (local)</localHomeTv><localHomeRadio>WBBM (English) | TBA (Español)</localHomeRadio></gameSchedule><gameSchedule season="2015" seasonType="PRE" week="1" gameId="2015081356" gameKey="56765" gameDate="08/13/2015" gameTimeEastern="22:00:00" gameTimeLocal="19:00:00" isoTime="2015-08-13T19:00:00-07:00" homeTeamId="4400" visitorTeamId="1200" homeTeamAbbr="SD" visitorTeamAbbr="DAL" homeDisplayName="San Diego Chargers" visitorDisplayName="Dallas Cowboys" homeNickname="Chargers" visitorNickname="Cowboys" gameType="PRE" weekNameAbbr="P1" weekName="Preseason Week 1"><visitorTeam season="2015" teamId="1200" abbr="DAL" cityState="Dallas" fullName="Dallas Cowboys" nick="Cowboys" teamType="TEAM" conferenceAbbr="NFC" divisionAbbr="NCE"/><homeTeam season="2015" teamId="4400" abbr="SD" cityState="San Diego" fullName="San Diego Chargers" nick="Chargers" teamType="TEAM" conferenceAbbr="AFC" divisionAbbr="ACW"/><site siteId="4200" siteCity="San Diego" siteState="CA" siteFullname="Qualcomm Stadium" roofType="OUTDOOR"/><localHomeTv>KFMB 8</localHomeTv><localHomeRadio>ROCK 105.3</localHomeRadio></gameSchedule><gameSchedule season="2015" seasonType="PRE" week="1" gameId="2015081451" gameKey="56766" gameDate="08/14/2015" gameTimeEastern="19:00:00" gameTimeLocal="19:00:00" isoTime="2015-08-14T16:00:00-07:00" homeTeamId="0200" visitorTeamId="2100" homeTeamAbbr="ATL" visitorTeamAbbr="TEN" homeDisplayName="Atlanta Falcons" visitorDisplayName="Tennessee Titans" homeNickname="Falcons" visitorNickname="Titans" gameType="PRE" weekNameAbbr="P1" weekName="Preseason Week 1"><visitorTeam season="2015" teamId="2100" abbr="TEN" cityState="Tennessee" fullName="Tennessee Titans" nick="Titans" teamType="TEAM" conferenceAbbr="AFC" divisionAbbr="ACS"/><homeTeam season="2015" teamId="0200" abbr="ATL" cityState="Atlanta" fullName="Atlanta Falcons" nick="Falcons" teamType="TEAM" conferenceAbbr="NFC" divisionAbbr="NCS"/><site siteId="2053" siteCity="Atlanta" siteState="GA" siteFullname="Georgia Dome" roofType="INDOOR"/></gameSchedule><gameSchedule season="2015" seasonType="PRE" week="1" gameId="2015081452" gameKey="56767" gameDate="08/14/2015" gameTimeEastern="19:00:00" gameTimeLocal="19:00:00" isoTime="2015-08-14T16:00:00-07:00" homeTeamId="0610" visitorTeamId="0750" homeTeamAbbr="BUF" visitorTeamAbbr="CAR" homeDisplayName="Buffalo Bills" visitorDisplayName="Carolina Panthers" homeNickname="Bills" visitorNickname="Panthers" gameType="PRE" weekNameAbbr="P1" weekName="Preseason Week 1"><visitorTeam season="2015" teamId="0750" abbr="CAR" cityState="Carolina" fullName="Carolina Panthers" nick="Panthers" teamType="TEAM" conferenceAbbr="NFC" divisionAbbr="NCS"/><homeTeam season="2015" teamId="0610" abbr="BUF" cityState="Buffalo" fullName="Buffalo Bills" nick="Bills" teamType="TEAM" conferenceAbbr="AFC" divisionAbbr="ACE"/><site siteId="3770" siteCity="Orchard Park" siteState="NY" siteFullname="Ralph Wilson Stadium" roofType="OUTDOOR"/></gameSchedule><gameSchedule season="2015" seasonType="PRE" week="1" gameId="2015081453" gameKey="56768" gameDate="08/14/2015" gameTimeEastern="19:30:00" gameTimeLocal="19:30:00" isoTime="2015-08-14T16:30:00-07:00" homeTeamId="0920" visitorTeamId="3410" homeTeamAbbr="CIN" visitorTeamAbbr="NYG" homeDisplayName="Cincinnati Bengals" visitorDisplayName="New York Giants" homeNickname="Bengals" visitorNickname="Giants" gameType="PRE" weekNameAbbr="P1" weekName="Preseason Week 1"><visitorTeam season="2015" teamId="3410" abbr="NYG" cityState="New York Giants" fullName="New York Giants" nick="Giants" teamType="TEAM" conferenceAbbr="NFC" divisionAbbr="NCE"/><homeTeam season="2015" teamId="0920" abbr="CIN" cityState="Cincinnati" fullName="Cincinnati Bengals" nick="Bengals" teamType="TEAM" conferenceAbbr="AFC" divisionAbbr="ACN"/><site siteId="3530" siteCity="Cincinnati" siteState="OH" siteFullname="Paul Brown Stadium" roofType="OUTDOOR"/><localAwayTv>WNBC 4 NY</localAwayTv><localAwayRadio>WCBS 880</localAwayRadio></gameSchedule><gameSchedule season="2015" seasonType="PRE" week="1" gameId="2015081454" gameKey="56769" gameDate="08/14/2015" gameTimeEastern="19:30:00" gameTimeLocal="19:30:00" isoTime="2015-08-14T16:30:00-07:00" homeTeamId="2250" visitorTeamId="3900" homeTeamAbbr="JAC" visitorTeamAbbr="PIT" homeDisplayName="Jacksonville Jaguars" visitorDisplayName="Pittsburgh Steelers" homeNickname="Jaguars" visitorNickname="Steelers" gameType="PRE" weekNameAbbr="P1" weekName="Preseason Week 1"><visitorTeam season="2015" teamId="3900" abbr="PIT" cityState="Pittsburgh" fullName="Pittsburgh Steelers" nick="Steelers" teamType="TEAM" conferenceAbbr="AFC" divisionAbbr="ACN"/><homeTeam season="2015" teamId="2250" abbr="JAC" cityState="Jacksonville" fullName="Jacksonville Jaguars" nick="Jaguars" teamType="TEAM" conferenceAbbr="AFC" divisionAbbr="ACS"/><site siteId="2049" siteCity="Jacksonville" siteState="FL" siteFullname="EverBank Field" roofType="OUTDOOR"/></gameSchedule><gameSchedule season="2015" seasonType="PRE" week="1" gameId="2015081455" gameKey="56770" gameDate="08/14/2015" gameTimeEastern="22:00:00" gameTimeLocal="19:00:00" isoTime="2015-08-14T19:00:00-07:00" homeTeamId="2520" visitorTeamId="2510" homeTeamAbbr="OAK" visitorTeamAbbr="STL" homeDisplayName="Oakland Raiders" visitorDisplayName="St. Louis Rams" homeNickname="Raiders" visitorNickname="Rams" gameType="PRE" weekNameAbbr="P1" weekName="Preseason Week 1"><visitorTeam season="2015" teamId="2510" abbr="STL" cityState="St. Louis" fullName="St. Louis Rams" nick="Rams" teamType="TEAM" conferenceAbbr="NFC" divisionAbbr="NCW"/><homeTeam season="2015" teamId="2520" abbr="OAK" cityState="Oakland" fullName="Oakland Raiders" nick="Raiders" teamType="TEAM" conferenceAbbr="AFC" divisionAbbr="ACW"/><site siteId="3225" siteCity="Oakland" siteState="CA" siteFullname="O.co Coliseum" roofType="OUTDOOR"/></gameSchedule><gameSchedule season="2015" seasonType="PRE" week="1" gameId="2015081456" gameKey="56771" gameDate="08/14/2015" gameTimeEastern="22:00:00" gameTimeLocal="19:00:00" isoTime="2015-08-14T19:00:00-07:00" homeTeamId="4600" visitorTeamId="1400" homeTeamAbbr="SEA" visitorTeamAbbr="DEN" homeDisplayName="Seattle Seahawks" visitorDisplayName="Denver Broncos" homeNickname="Seahawks" visitorNickname="Broncos" gameType="PRE" weekNameAbbr="P1" weekName="Preseason Week 1"><visitorTeam season="2015" teamId="1400" abbr="DEN" cityState="Denver" fullName="Denver Broncos" nick="Broncos" teamType="TEAM" conferenceAbbr="AFC" divisionAbbr="ACW"/><homeTeam season="2015" teamId="4600" abbr="SEA" cityState="Seattle" fullName="Seattle Seahawks" nick="Seahawks" teamType="TEAM" conferenceAbbr="NFC" divisionAbbr="NCW"/><site siteId="5315" siteCity="Seattle" siteState="WA" siteFullname="CenturyLink Field" roofType="OUTDOOR"/><localHomeTv>Q13 FOX</localHomeTv><localAwayTv>KTVD-20</localAwayTv><localAwayRadio>850 KOA</localAwayRadio></gameSchedule><gameSchedule season="2015" seasonType="PRE" week="1" gameId="2015081551" gameKey="56772" gameDate="08/15/2015" gameTimeEastern="20:00:00" gameTimeLocal="19:00:00" isoTime="2015-08-15T17:00:00-07:00" homeTeamId="3000" visitorTeamId="4900" homeTeamAbbr="MIN" visitorTeamAbbr="TB" homeDisplayName="Minnesota Vikings" visitorDisplayName="Tampa Bay Buccaneers" homeNickname="Vikings" visitorNickname="Buccaneers" gameType="PRE" weekNameAbbr="P1" weekName="Preseason Week 1"><visitorTeam season="2015" teamId="4900" abbr="TB" cityState="Tampa Bay" fullName="Tampa Bay Buccaneers" nick="Buccaneers" teamType="TEAM" conferenceAbbr="NFC" divisionAbbr="NCS"/><homeTeam season="2015" teamId="3000" abbr="MIN" cityState="Minnesota" fullName="Minnesota Vikings" nick="Vikings" teamType="TEAM" conferenceAbbr="NFC" divisionAbbr="NCN"/><site siteId="5606" siteCity="Minneapolis" siteState="MN" siteFullname="TCF Bank Stadium" roofType="OUTDOOR"/></gameSchedule><gameSchedule season="2015" seasonType="PRE" week="1" gameId="2015081552" gameKey="56773" gameDate="08/15/2015" gameTimeEastern="20:00:00" gameTimeLocal="19:00:00" isoTime="2015-08-15T17:00:00-07:00" homeTeamId="2120" visitorTeamId="4500" homeTeamAbbr="HOU" visitorTeamAbbr="SF" homeDisplayName="Houston Texans" visitorDisplayName="San Francisco 49ers" homeNickname="Texans" visitorNickname="49ers" gameType="PRE" weekNameAbbr="P1" weekName="Preseason Week 1"><visitorTeam season="2015" teamId="4500" abbr="SF" cityState="San Francisco" fullName="San Francisco 49ers" nick="49ers" teamType="TEAM" conferenceAbbr="NFC" divisionAbbr="NCW"/><homeTeam season="2015" teamId="2120" abbr="HOU" cityState="Houston" fullName="Houston Texans" nick="Texans" teamType="TEAM" conferenceAbbr="AFC" divisionAbbr="ACS"/><site siteId="3698" siteCity="Houston" siteState="TX" siteFullname="NRG Stadium" roofType="OUTDOOR"/></gameSchedule><gameSchedule season="2015" seasonType="PRE" week="1" gameId="2015081553" gameKey="56774" gameDate="08/15/2015" gameTimeEastern="21:00:00" gameTimeLocal="18:00:00" isoTime="2015-08-15T18:00:00-07:00" homeTeamId="3800" visitorTeamId="2310" homeTeamAbbr="ARI" visitorTeamAbbr="KC" homeDisplayName="Arizona Cardinals" visitorDisplayName="Kansas City Chiefs" homeNickname="Cardinals" visitorNickname="Chiefs" gameType="PRE" weekNameAbbr="P1" weekName="Preseason Week 1"><visitorTeam season="2015" teamId="2310" abbr="KC" cityState="Kansas City" fullName="Kansas City Chiefs" nick="Chiefs" teamType="TEAM" conferenceAbbr="AFC" divisionAbbr="ACW"/><homeTeam season="2015" teamId="3800" abbr="ARI" cityState="Arizona" fullName="Arizona Cardinals" nick="Cardinals" teamType="TEAM" conferenceAbbr="NFC" divisionAbbr="NCW"/><site siteId="1907" siteCity="Glendale" siteState="AZ" siteFullname="University of Phoenix Stadium" roofType="RETRACTABLE"/></gameSchedule><gameSchedule season="2015" seasonType="PRE" week="1" gameId="2015081651" gameKey="56775" gameDate="08/16/2015" gameTimeEastern="13:00:00" gameTimeLocal="13:00:00" isoTime="2015-08-16T10:00:00-07:00" homeTeamId="3700" visitorTeamId="2200" homeTeamAbbr="PHI" visitorTeamAbbr="IND" homeDisplayName="Philadelphia Eagles" visitorDisplayName="Indianapolis Colts" homeNickname="Eagles" visitorNickname="Colts" gameType="PRE" weekNameAbbr="P1" weekName="Preseason Week 1"><visitorTeam season="2015" teamId="2200" abbr="IND" cityState="Indianapolis" fullName="Indianapolis Colts" nick="Colts" teamType="TEAM" conferenceAbbr="AFC" divisionAbbr="ACS"/><homeTeam season="2015" teamId="3700" abbr="PHI" cityState="Philadelphia" fullName="Philadelphia Eagles" nick="Eagles" teamType="TEAM" conferenceAbbr="NFC" divisionAbbr="NCE"/><site siteId="2769" siteCity="Philadelphia" siteState="PA" siteFullname="Lincoln Financial Field" roofType="OUTDOOR"/><localAwayTv>FOX59</localAwayTv></gameSchedule><gameSchedule season="2015" seasonType="PRE" week="2" gameId="2015082051" gameKey="56776" gameDate="08/20/2015" gameTimeEastern="19:30:00" gameTimeLocal="19:30:00" isoTime="2015-08-20T16:30:00-07:00" homeTeamId="5110" visitorTeamId="1540" homeTeamAbbr="WAS" visitorTeamAbbr="DET" homeDisplayName="Washington Redskins" visitorDisplayName="Detroit Lions" homeNickname="Redskins" visitorNickname="Lions" gameType="PRE" weekNameAbbr="P2" weekName="Preseason Week 2"><visitorTeam season="2015" teamId="1540" abbr="DET" cityState="Detroit" fullName="Detroit Lions" nick="Lions" teamType="TEAM" conferenceAbbr="NFC" divisionAbbr="NCN"/><homeTeam season="2015" teamId="5110" abbr="WAS" cityState="Washington" fullName="Washington Redskins" nick="Redskins" teamType="TEAM" conferenceAbbr="NFC" divisionAbbr="NCE"/><site siteId="2389" siteCity="Landover" siteState="MD" siteFullname="FedExField" roofType="OUTDOOR"/></gameSchedule><gameSchedule season="2015" seasonType="PRE" week="2" gameId="2015082052" gameKey="56777" gameDate="08/20/2015" gameTimeEastern="20:00:00" gameTimeLocal="20:00:00" isoTime="2015-08-20T17:00:00-07:00" homeTeamId="1050" visitorTeamId="0610" homeTeamAbbr="CLE" visitorTeamAbbr="BUF" homeDisplayName="Cleveland Browns" visitorDisplayName="Buffalo Bills" homeNickname="Browns" visitorNickname="Bills" gameType="PRE" weekNameAbbr="P2" weekName="Preseason Week 2"><visitorTeam season="2015" teamId="0610" abbr="BUF" cityState="Buffalo" fullName="Buffalo Bills" nick="Bills" teamType="TEAM" conferenceAbbr="AFC" divisionAbbr="ACE"/><homeTeam season="2015" teamId="1050" abbr="CLE" cityState="Cleveland" fullName="Cleveland Browns" nick="Browns" teamType="TEAM" conferenceAbbr="AFC" divisionAbbr="ACN"/><site siteId="1048" siteCity="Cleveland" siteState="OH" siteFullname="FirstEnergy Stadium" roofType="OUTDOOR"/><networkChannel>ESPN</networkChannel></gameSchedule><gameSchedule season="2015" seasonType="PRE" week="2" gameId="2015082151" gameKey="56778" gameDate="08/21/2015" gameTimeEastern="19:30:00" gameTimeLocal="19:30:00" isoTime="2015-08-21T16:30:00-07:00" homeTeamId="3430" visitorTeamId="0200" homeTeamAbbr="NYJ" visitorTeamAbbr="ATL" homeDisplayName="New York Jets" visitorDisplayName="Atlanta Falcons" homeNickname="Jets" visitorNickname="Falcons" gameType="PRE" weekNameAbbr="P2" weekName="Preseason Week 2"><visitorTeam season="2015" teamId="0200" abbr="ATL" cityState="Atlanta" fullName="Atlanta Falcons" nick="Falcons" teamType="TEAM" conferenceAbbr="NFC" divisionAbbr="NCS"/><homeTeam season="2015" teamId="3430" abbr="NYJ" cityState="New York Jets" fullName="New York Jets" nick="Jets" teamType="TEAM" conferenceAbbr="AFC" divisionAbbr="ACE"/><site siteId="3757" siteCity="East Rutherford" siteState="NJ" siteFullname="MetLife Stadium" roofType="OUTDOOR"/></gameSchedule><gameSchedule season="2015" seasonType="PRE" week="2" gameId="2015082152" gameKey="56779" gameDate="08/21/2015" gameTimeEastern="20:00:00" gameTimeLocal="19:00:00" isoTime="2015-08-21T17:00:00-07:00" homeTeamId="2310" visitorTeamId="4600" homeTeamAbbr="KC" visitorTeamAbbr="SEA" homeDisplayName="Kansas City Chiefs" visitorDisplayName="Seattle Seahawks" homeNickname="Chiefs" visitorNickname="Seahawks" gameType="PRE" weekNameAbbr="P2" weekName="Preseason Week 2"><visitorTeam season="2015" teamId="4600" abbr="SEA" cityState="Seattle" fullName="Seattle Seahawks" nick="Seahawks" teamType="TEAM" conferenceAbbr="NFC" divisionAbbr="NCW"/><homeTeam season="2015" teamId="2310" abbr="KC" cityState="Kansas City" fullName="Kansas City Chiefs" nick="Chiefs" teamType="TEAM" conferenceAbbr="AFC" divisionAbbr="ACW"/><site siteId="1552" siteCity="Kansas City" siteState="MO" siteFullname="Arrowhead Stadium" roofType="OUTDOOR"/><localAwayTv>Q13 FOX</localAwayTv></gameSchedule><gameSchedule season="2015" seasonType="PRE" week="2" gameId="2015082251" gameKey="56780" gameDate="08/22/2015" gameTimeEastern="19:00:00" gameTimeLocal="19:00:00" isoTime="2015-08-22T16:00:00-07:00" homeTeamId="0750" visitorTeamId="2700" homeTeamAbbr="CAR" visitorTeamAbbr="MIA" homeDisplayName="Carolina Panthers" visitorDisplayName="Miami Dolphins" homeNickname="Panthers" visitorNickname="Dolphins" gameType="PRE" weekNameAbbr="P2" weekName="Preseason Week 2"><visitorTeam season="2015" teamId="2700" abbr="MIA" cityState="Miami" fullName="Miami Dolphins" nick="Dolphins" teamType="TEAM" conferenceAbbr="AFC" divisionAbbr="ACE"/><homeTeam season="2015" teamId="0750" abbr="CAR" cityState="Carolina" fullName="Carolina Panthers" nick="Panthers" teamType="TEAM" conferenceAbbr="NFC" divisionAbbr="NCS"/><site siteId="1769" siteCity="Charlotte" siteState="NC" siteFullname="Bank of America Stadium" roofType="OUTDOOR"/></gameSchedule><gameSchedule season="2015" seasonType="PRE" week="2" gameId="2015082252" gameKey="56781" gameDate="08/22/2015" gameTimeEastern="19:00:00" gameTimeLocal="19:00:00" isoTime="2015-08-22T16:00:00-07:00" homeTeamId="3700" visitorTeamId="0325" homeTeamAbbr="PHI" visitorTeamAbbr="BAL" homeDisplayName="Philadelphia Eagles" visitorDisplayName="Baltimore Ravens" homeNickname="Eagles" visitorNickname="Ravens" gameType="PRE" weekNameAbbr="P2" weekName="Preseason Week 2"><visitorTeam season="2015" teamId="0325" abbr="BAL" cityState="Baltimore" fullName="Baltimore Ravens" nick="Ravens" teamType="TEAM" conferenceAbbr="AFC" divisionAbbr="ACN"/><homeTeam season="2015" teamId="3700" abbr="PHI" cityState="Philadelphia" fullName="Philadelphia Eagles" nick="Eagles" teamType="TEAM" conferenceAbbr="NFC" divisionAbbr="NCE"/><site siteId="2769" siteCity="Philadelphia" siteState="PA" siteFullname="Lincoln Financial Field" roofType="OUTDOOR"/></gameSchedule><gameSchedule season="2015" seasonType="PRE" week="2" gameId="2015082253" gameKey="56782" gameDate="08/22/2015" gameTimeEastern="19:30:00" gameTimeLocal="19:30:00" isoTime="2015-08-22T16:30:00-07:00" homeTeamId="2200" visitorTeamId="0810" homeTeamAbbr="IND" visitorTeamAbbr="CHI" homeDisplayName="Indianapolis Colts" visitorDisplayName="Chicago Bears" homeNickname="Colts" visitorNickname="Bears" gameType="PRE" weekNameAbbr="P2" weekName="Preseason Week 2"><visitorTeam season="2015" teamId="0810" abbr="CHI" cityState="Chicago" fullName="Chicago Bears" nick="Bears" teamType="TEAM" conferenceAbbr="NFC" divisionAbbr="NCN"/><homeTeam season="2015" teamId="2200" abbr="IND" cityState="Indianapolis" fullName="Indianapolis Colts" nick="Colts" teamType="TEAM" conferenceAbbr="AFC" divisionAbbr="ACS"/><site siteId="2878" siteCity="Indianapolis" siteState="IN" siteFullname="Lucas Oil Stadium" roofType="INDOOR"/><localHomeTv>FOX59</localHomeTv><localAwayTv>FOX (local)</localAwayTv><localAwayRadio>WBBM (English) | TBA (Español)</localAwayRadio></gameSchedule><gameSchedule season="2015" seasonType="PRE" week="2" gameId="2015082254" gameKey="56783" gameDate="08/22/2015" gameTimeEastern="19:30:00" gameTimeLocal="18:30:00" isoTime="2015-08-22T16:30:00-07:00" homeTeamId="3300" visitorTeamId="3200" homeTeamAbbr="NO" visitorTeamAbbr="NE" homeDisplayName="New Orleans Saints" visitorDisplayName="New England Patriots" homeNickname="Saints" visitorNickname="Patriots" gameType="PRE" weekNameAbbr="P2" weekName="Preseason Week 2"><visitorTeam season="2015" teamId="3200" abbr="NE" cityState="New England" fullName="New England Patriots" nick="Patriots" teamType="TEAM" conferenceAbbr="AFC" divisionAbbr="ACE"/><homeTeam season="2015" teamId="3300" abbr="NO" cityState="New Orleans" fullName="New Orleans Saints" nick="Saints" teamType="TEAM" conferenceAbbr="NFC" divisionAbbr="NCS"/><site siteId="2870" siteCity="New Orleans" siteState="LA" siteFullname="Mercedes-Benz Superdome" roofType="INDOOR"/><localAwayTv>WBZ / Patriots Preseason Network</localAwayTv><localAwayRadio>98.5 FM The Sports Hub</localAwayRadio></gameSchedule><gameSchedule season="2015" seasonType="PRE" week="2" gameId="2015082255" gameKey="56784" gameDate="08/22/2015" gameTimeEastern="19:30:00" gameTimeLocal="19:30:00" isoTime="2015-08-22T16:30:00-07:00" homeTeamId="3410" visitorTeamId="2250" homeTeamAbbr="NYG" visitorTeamAbbr="JAC" homeDisplayName="New York Giants" visitorDisplayName="Jacksonville Jaguars" homeNickname="Giants" visitorNickname="Jaguars" gameType="PRE" weekNameAbbr="P2" weekName="Preseason Week 2"><visitorTeam season="2015" teamId="2250" abbr="JAC" cityState="Jacksonville" fullName="Jacksonville Jaguars" nick="Jaguars" teamType="TEAM" conferenceAbbr="AFC" divisionAbbr="ACS"/><homeTeam season="2015" teamId="3410" abbr="NYG" cityState="New York Giants" fullName="New York Giants" nick="Giants" teamType="TEAM" conferenceAbbr="NFC" divisionAbbr="NCE"/><site siteId="3757" siteCity="East Rutherford" siteState="NJ" siteFullname="MetLife Stadium" roofType="OUTDOOR"/><localHomeTv>WNBC 4 NY</localHomeTv><localHomeRadio>WFAN</localHomeRadio></gameSchedule><gameSchedule season="2015" seasonType="PRE" week="2" gameId="2015082256" gameKey="56785" gameDate="08/22/2015" gameTimeEastern="20:00:00" gameTimeLocal="19:00:00" isoTime="2015-08-22T17:00:00-07:00" homeTeamId="2120" visitorTeamId="1400" homeTeamAbbr="HOU" visitorTeamAbbr="DEN" homeDisplayName="Houston Texans" visitorDisplayName="Denver Broncos" homeNickname="Texans" visitorNickname="Broncos" gameType="PRE" weekNameAbbr="P2" weekName="Preseason Week 2"><visitorTeam season="2015" teamId="1400" abbr="DEN" cityState="Denver" fullName="Denver Broncos" nick="Broncos" teamType="TEAM" conferenceAbbr="AFC" divisionAbbr="ACW"/><homeTeam season="2015" teamId="2120" abbr="HOU" cityState="Houston" fullName="Houston Texans" nick="Texans" teamType="TEAM" conferenceAbbr="AFC" divisionAbbr="ACS"/><site siteId="3698" siteCity="Houston" siteState="TX" siteFullname="NRG Stadium" roofType="OUTDOOR"/></gameSchedule><gameSchedule season="2015" seasonType="PRE" week="2" gameId="2015082257" gameKey="56786" gameDate="08/22/2015" gameTimeEastern="20:00:00" gameTimeLocal="19:00:00" isoTime="2015-08-22T17:00:00-07:00" homeTeamId="3000" visitorTeamId="2520" homeTeamAbbr="MIN" visitorTeamAbbr="OAK" homeDisplayName="Minnesota Vikings" visitorDisplayName="Oakland Raiders" homeNickname="Vikings" visitorNickname="Raiders" gameType="PRE" weekNameAbbr="P2" weekName="Preseason Week 2"><visitorTeam season="2015" teamId="2520" abbr="OAK" cityState="Oakland" fullName="Oakland Raiders" nick="Raiders" teamType="TEAM" conferenceAbbr="AFC" divisionAbbr="ACW"/><homeTeam season="2015" teamId="3000" abbr="MIN" cityState="Minnesota" fullName="Minnesota Vikings" nick="Vikings" teamType="TEAM" conferenceAbbr="NFC" divisionAbbr="NCN"/><site siteId="5606" siteCity="Minneapolis" siteState="MN" siteFullname="TCF Bank Stadium" roofType="OUTDOOR"/></gameSchedule><gameSchedule season="2015" seasonType="PRE" week="2" gameId="2015082258" gameKey="56787" gameDate="08/22/2015" gameTimeEastern="22:00:00" gameTimeLocal="19:00:00" isoTime="2015-08-22T19:00:00-07:00" homeTeamId="3800" visitorTeamId="4400" homeTeamAbbr="ARI" visitorTeamAbbr="SD" homeDisplayName="Arizona Cardinals" visitorDisplayName="San Diego Chargers" homeNickname="Cardinals" visitorNickname="Chargers" gameType="PRE" weekNameAbbr="P2" weekName="Preseason Week 2"><visitorTeam season="2015" teamId="4400" abbr="SD" cityState="San Diego" fullName="San Diego Chargers" nick="Chargers" teamType="TEAM" conferenceAbbr="AFC" divisionAbbr="ACW"/><homeTeam season="2015" teamId="3800" abbr="ARI" cityState="Arizona" fullName="Arizona Cardinals" nick="Cardinals" teamType="TEAM" conferenceAbbr="NFC" divisionAbbr="NCW"/><site siteId="1907" siteCity="Glendale" siteState="AZ" siteFullname="University of Phoenix Stadium" roofType="RETRACTABLE"/><localAwayTv>KFMB 8</localAwayTv><localAwayRadio>ROCK 105.3</localAwayRadio></gameSchedule><gameSchedule season="2015" seasonType="PRE" week="2" gameId="2015082351" gameKey="56788" gameDate="08/23/2015" gameTimeEastern="13:00:00" gameTimeLocal="13:00:00" isoTime="2015-08-23T10:00:00-07:00" homeTeamId="3900" visitorTeamId="1800" homeTeamAbbr="PIT" visitorTeamAbbr="GB" homeDisplayName="Pittsburgh Steelers" visitorDisplayName="Green Bay Packers" homeNickname="Steelers" visitorNickname="Packers" gameType="PRE" weekNameAbbr="P2" weekName="Preseason Week 2"><visitorTeam season="2015" teamId="1800" abbr="GB" cityState="Green Bay" fullName="Green Bay Packers" nick="Packers" teamType="TEAM" conferenceAbbr="NFC" divisionAbbr="NCN"/><homeTeam season="2015" teamId="3900" abbr="PIT" cityState="Pittsburgh" fullName="Pittsburgh Steelers" nick="Steelers" teamType="TEAM" conferenceAbbr="AFC" divisionAbbr="ACN"/><site siteId="5411" siteCity="Pittsburgh" siteState="PA" siteFullname="Heinz Field" roofType="OUTDOOR"/><radioSatelliteAway>108</radioSatelliteAway></gameSchedule><gameSchedule season="2015" seasonType="PRE" week="2" gameId="2015082352" gameKey="56789" gameDate="08/23/2015" gameTimeEastern="20:00:00" gameTimeLocal="17:00:00" isoTime="2015-08-23T17:00:00-07:00" homeTeamId="4500" visitorTeamId="1200" homeTeamAbbr="SF" visitorTeamAbbr="DAL" homeDisplayName="San Francisco 49ers" visitorDisplayName="Dallas Cowboys" homeNickname="49ers" visitorNickname="Cowboys" gameType="PRE" weekNameAbbr="P2" weekName="Preseason Week 2"><visitorTeam season="2015" teamId="1200" abbr="DAL" cityState="Dallas" fullName="Dallas Cowboys" nick="Cowboys" teamType="TEAM" conferenceAbbr="NFC" divisionAbbr="NCE"/><homeTeam season="2015" teamId="4500" abbr="SF" cityState="San Francisco" fullName="San Francisco 49ers" nick="49ers" teamType="TEAM" conferenceAbbr="NFC" divisionAbbr="NCW"/><site siteId="2099" siteCity="Santa Clara" siteState="CA" siteFullname="Levi's Stadium" roofType="OUTDOOR"/></gameSchedule><gameSchedule season="2015" seasonType="PRE" week="2" gameId="2015082353" gameKey="56790" gameDate="08/23/2015" gameTimeEastern="20:00:00" gameTimeLocal="19:00:00" isoTime="2015-08-23T17:00:00-07:00" homeTeamId="2100" visitorTeamId="2510" homeTeamAbbr="TEN" visitorTeamAbbr="STL" homeDisplayName="Tennessee Titans" visitorDisplayName="St. Louis Rams" homeNickname="Titans" visitorNickname="Rams" gameType="PRE" weekNameAbbr="P2" weekName="Preseason Week 2"><visitorTeam season="2015" teamId="2510" abbr="STL" cityState="St. Louis" fullName="St. Louis Rams" nick="Rams" teamType="TEAM" conferenceAbbr="NFC" divisionAbbr="NCW"/><homeTeam season="2015" teamId="2100" abbr="TEN" cityState="Tennessee" fullName="Tennessee Titans" nick="Titans" teamType="TEAM" conferenceAbbr="AFC" divisionAbbr="ACS"/><site siteId="2350" siteCity="Nashville" siteState="TN" siteFullname="Nissan Stadium" roofType="OUTDOOR"/><networkChannel>FOX</networkChannel></gameSchedule><gameSchedule season="2015" seasonType="PRE" week="2" gameId="2015082451" gameKey="56791" gameDate="08/24/2015" gameTimeEastern="20:00:00" gameTimeLocal="20:00:00" isoTime="2015-08-24T17:00:00-07:00" homeTeamId="4900" visitorTeamId="0920" homeTeamAbbr="TB" visitorTeamAbbr="CIN" homeDisplayName="Tampa Bay Buccaneers" visitorDisplayName="Cincinnati Bengals" homeNickname="Buccaneers" visitorNickname="Bengals" gameType="PRE" weekNameAbbr="P2" weekName="Preseason Week 2"><visitorTeam season="2015" teamId="0920" abbr="CIN" cityState="Cincinnati" fullName="Cincinnati Bengals" nick="Bengals" teamType="TEAM" conferenceAbbr="AFC" divisionAbbr="ACN"/><homeTeam season="2015" teamId="4900" abbr="TB" cityState="Tampa Bay" fullName="Tampa Bay Buccaneers" nick="Buccaneers" teamType="TEAM" conferenceAbbr="NFC" divisionAbbr="NCS"/><site siteId="3697" siteCity="Tampa" siteState="FL" siteFullname="Raymond James Stadium" roofType="OUTDOOR"/><networkChannel>ESPN</networkChannel></gameSchedule><gameSchedule season="2015" seasonType="PRE" week="3" gameId="2015082851" gameKey="56792" gameDate="08/28/2015" gameTimeEastern="19:30:00" gameTimeLocal="19:30:00" isoTime="2015-08-28T16:30:00-07:00" homeTeamId="0750" visitorTeamId="3200" homeTeamAbbr="CAR" visitorTeamAbbr="NE" homeDisplayName="Carolina Panthers" visitorDisplayName="New England Patriots" homeNickname="Panthers" visitorNickname="Patriots" gameType="PRE" weekNameAbbr="P3" weekName="Preseason Week 3"><visitorTeam season="2015" teamId="3200" abbr="NE" cityState="New England" fullName="New England Patriots" nick="Patriots" teamType="TEAM" conferenceAbbr="AFC" divisionAbbr="ACE"/><homeTeam season="2015" teamId="0750" abbr="CAR" cityState="Carolina" fullName="Carolina Panthers" nick="Panthers" teamType="TEAM" conferenceAbbr="NFC" divisionAbbr="NCS"/><site siteId="1769" siteCity="Charlotte" siteState="NC" siteFullname="Bank of America Stadium" roofType="OUTDOOR"/><localAwayTv>WBZ / Patriots Preseason Network</localAwayTv><localAwayRadio>98.5 FM The Sports Hub</localAwayRadio></gameSchedule><gameSchedule season="2015" seasonType="PRE" week="3" gameId="2015082852" gameKey="56793" gameDate="08/28/2015" gameTimeEastern="20:00:00" gameTimeLocal="20:00:00" isoTime="2015-08-28T17:00:00-07:00" homeTeamId="2250" visitorTeamId="1540" homeTeamAbbr="JAC" visitorTeamAbbr="DET" homeDisplayName="Jacksonville Jaguars" visitorDisplayName="Detroit Lions" homeNickname="Jaguars" visitorNickname="Lions" gameType="PRE" weekNameAbbr="P3" weekName="Preseason Week 3"><visitorTeam season="2015" teamId="1540" abbr="DET" cityState="Detroit" fullName="Detroit Lions" nick="Lions" teamType="TEAM" conferenceAbbr="NFC" divisionAbbr="NCN"/><homeTeam season="2015" teamId="2250" abbr="JAC" cityState="Jacksonville" fullName="Jacksonville Jaguars" nick="Jaguars" teamType="TEAM" conferenceAbbr="AFC" divisionAbbr="ACS"/><site siteId="2049" siteCity="Jacksonville" siteState="FL" siteFullname="EverBank Field" roofType="OUTDOOR"/><networkChannel>CBS</networkChannel></gameSchedule><gameSchedule season="2015" seasonType="PRE" week="3" gameId="2015082853" gameKey="56794" gameDate="08/28/2015" gameTimeEastern="20:00:00" gameTimeLocal="19:00:00" isoTime="2015-08-28T17:00:00-07:00" homeTeamId="2310" visitorTeamId="2100" homeTeamAbbr="KC" visitorTeamAbbr="TEN" homeDisplayName="Kansas City Chiefs" visitorDisplayName="Tennessee Titans" homeNickname="Chiefs" visitorNickname="Titans" gameType="PRE" weekNameAbbr="P3" weekName="Preseason Week 3"><visitorTeam season="2015" teamId="2100" abbr="TEN" cityState="Tennessee" fullName="Tennessee Titans" nick="Titans" teamType="TEAM" conferenceAbbr="AFC" divisionAbbr="ACS"/><homeTeam season="2015" teamId="2310" abbr="KC" cityState="Kansas City" fullName="Kansas City Chiefs" nick="Chiefs" teamType="TEAM" conferenceAbbr="AFC" divisionAbbr="ACW"/><site siteId="1552" siteCity="Kansas City" siteState="MO" siteFullname="Arrowhead Stadium" roofType="OUTDOOR"/></gameSchedule><gameSchedule season="2015" seasonType="PRE" week="3" gameId="2015082951" gameKey="56795" gameDate="08/29/2015" gameTimeEastern="16:00:00" gameTimeLocal="16:00:00" isoTime="2015-08-29T13:00:00-07:00" homeTeamId="0610" visitorTeamId="3900" homeTeamAbbr="BUF" visitorTeamAbbr="PIT" homeDisplayName="Buffalo Bills" visitorDisplayName="Pittsburgh Steelers" homeNickname="Bills" visitorNickname="Steelers" gameType="PRE" weekNameAbbr="P3" weekName="Preseason Week 3"><visitorTeam season="2015" teamId="3900" abbr="PIT" cityState="Pittsburgh" fullName="Pittsburgh Steelers" nick="Steelers" teamType="TEAM" conferenceAbbr="AFC" divisionAbbr="ACN"/><homeTeam season="2015" teamId="0610" abbr="BUF" cityState="Buffalo" fullName="Buffalo Bills" nick="Bills" teamType="TEAM" conferenceAbbr="AFC" divisionAbbr="ACE"/><site siteId="3770" siteCity="Orchard Park" siteState="NY" siteFullname="Ralph Wilson Stadium" roofType="OUTDOOR"/></gameSchedule><gameSchedule season="2015" seasonType="PRE" week="3" gameId="2015082952" gameKey="56796" gameDate="08/29/2015" gameTimeEastern="19:00:00" gameTimeLocal="18:00:00" isoTime="2015-08-29T16:00:00-07:00" homeTeamId="1200" visitorTeamId="3000" homeTeamAbbr="DAL" visitorTeamAbbr="MIN" homeDisplayName="Dallas Cowboys" visitorDisplayName="Minnesota Vikings" homeNickname="Cowboys" visitorNickname="Vikings" gameType="PRE" weekNameAbbr="P3" weekName="Preseason Week 3"><visitorTeam season="2015" teamId="3000" abbr="MIN" cityState="Minnesota" fullName="Minnesota Vikings" nick="Vikings" teamType="TEAM" conferenceAbbr="NFC" divisionAbbr="NCN"/><homeTeam season="2015" teamId="1200" abbr="DAL" cityState="Dallas" fullName="Dallas Cowboys" nick="Cowboys" teamType="TEAM" conferenceAbbr="NFC" divisionAbbr="NCE"/><site siteId="4948" siteCity="Arlington" siteState="TX" siteFullname="AT&amp;T Stadium" roofType="RETRACTABLE"/></gameSchedule><gameSchedule season="2015" seasonType="PRE" week="3" gameId="2015082955" gameKey="56799" gameDate="08/29/2015" gameTimeEastern="19:00:00" gameTimeLocal="19:00:00" isoTime="2015-08-29T16:00:00-07:00" homeTeamId="4900" visitorTeamId="1050" homeTeamAbbr="TB" visitorTeamAbbr="CLE" homeDisplayName="Tampa Bay Buccaneers" visitorDisplayName="Cleveland Browns" homeNickname="Buccaneers" visitorNickname="Browns" gameType="PRE" weekNameAbbr="P3" weekName="Preseason Week 3"><visitorTeam season="2015" teamId="1050" abbr="CLE" cityState="Cleveland" fullName="Cleveland Browns" nick="Browns" teamType="TEAM" conferenceAbbr="AFC" divisionAbbr="ACN"/><homeTeam season="2015" teamId="4900" abbr="TB" cityState="Tampa Bay" fullName="Tampa Bay Buccaneers" nick="Buccaneers" teamType="TEAM" conferenceAbbr="NFC" divisionAbbr="NCS"/><site siteId="3697" siteCity="Tampa" siteState="FL" siteFullname="Raymond James Stadium" roofType="OUTDOOR"/></gameSchedule><gameSchedule season="2015" seasonType="PRE" week="3" gameId="2015082954" gameKey="56798" gameDate="08/29/2015" gameTimeEastern="19:00:00" gameTimeLocal="19:00:00" isoTime="2015-08-29T16:00:00-07:00" homeTeamId="3410" visitorTeamId="3430" homeTeamAbbr="NYG" visitorTeamAbbr="NYJ" homeDisplayName="New York Giants" visitorDisplayName="New York Jets" homeNickname="Giants" visitorNickname="Jets" gameType="PRE" weekNameAbbr="P3" weekName="Preseason Week 3"><visitorTeam season="2015" teamId="3430" abbr="NYJ" cityState="New York Jets" fullName="New York Jets" nick="Jets" teamType="TEAM" conferenceAbbr="AFC" divisionAbbr="ACE"/><homeTeam season="2015" teamId="3410" abbr="NYG" cityState="New York Giants" fullName="New York Giants" nick="Giants" teamType="TEAM" conferenceAbbr="NFC" divisionAbbr="NCE"/><site siteId="3757" siteCity="East Rutherford" siteState="NJ" siteFullname="MetLife Stadium" roofType="OUTDOOR"/><localHomeTv>WNBC 4 NY</localHomeTv><localHomeRadio>WCBS 880 AM</localHomeRadio></gameSchedule><gameSchedule season="2015" seasonType="PRE" week="3" gameId="2015082953" gameKey="56797" gameDate="08/29/2015" gameTimeEastern="19:00:00" gameTimeLocal="19:00:00" isoTime="2015-08-29T16:00:00-07:00" homeTeamId="2700" visitorTeamId="0200" homeTeamAbbr="MIA" visitorTeamAbbr="ATL" homeDisplayName="Miami Dolphins" visitorDisplayName="Atlanta Falcons" homeNickname="Dolphins" visitorNickname="Falcons" gameType="PRE" weekNameAbbr="P3" weekName="Preseason Week 3"><visitorTeam season="2015" teamId="0200" abbr="ATL" cityState="Atlanta" fullName="Atlanta Falcons" nick="Falcons" teamType="TEAM" conferenceAbbr="NFC" divisionAbbr="NCS"/><homeTeam season="2015" teamId="2700" abbr="MIA" cityState="Miami" fullName="Miami Dolphins" nick="Dolphins" teamType="TEAM" conferenceAbbr="AFC" divisionAbbr="ACE"/><site siteId="2475" siteCity="Miami Gardens" siteState="FL" siteFullname="Sun Life Stadium" roofType="OUTDOOR"/></gameSchedule><gameSchedule season="2015" seasonType="PRE" week="3" gameId="2015082956" gameKey="56800" gameDate="08/29/2015" gameTimeEastern="19:30:00" gameTimeLocal="19:30:00" isoTime="2015-08-29T16:30:00-07:00" homeTeamId="0325" visitorTeamId="5110" homeTeamAbbr="BAL" visitorTeamAbbr="WAS" homeDisplayName="Baltimore Ravens" visitorDisplayName="Washington Redskins" homeNickname="Ravens" visitorNickname="Redskins" gameType="PRE" weekNameAbbr="P3" weekName="Preseason Week 3"><visitorTeam season="2015" teamId="5110" abbr="WAS" cityState="Washington" fullName="Washington Redskins" nick="Redskins" teamType="TEAM" conferenceAbbr="NFC" divisionAbbr="NCE"/><homeTeam season="2015" teamId="0325" abbr="BAL" cityState="Baltimore" fullName="Baltimore Ravens" nick="Ravens" teamType="TEAM" conferenceAbbr="AFC" divisionAbbr="ACN"/><site siteId="3695" siteCity="Baltimore" siteState="MD" siteFullname="M&amp;T Bank Stadium" roofType="OUTDOOR"/><localAwayTv>NBC CSN</localAwayTv></gameSchedule><gameSchedule season="2015" seasonType="PRE" week="3" gameId="2015082957" gameKey="56801" gameDate="08/29/2015" gameTimeEastern="19:30:00" gameTimeLocal="19:30:00" isoTime="2015-08-29T16:30:00-07:00" homeTeamId="0920" visitorTeamId="0810" homeTeamAbbr="CIN" visitorTeamAbbr="CHI" homeDisplayName="Cincinnati Bengals" visitorDisplayName="Chicago Bears" homeNickname="Bengals" visitorNickname="Bears" gameType="PRE" weekNameAbbr="P3" weekName="Preseason Week 3"><visitorTeam season="2015" teamId="0810" abbr="CHI" cityState="Chicago" fullName="Chicago Bears" nick="Bears" teamType="TEAM" conferenceAbbr="NFC" divisionAbbr="NCN"/><homeTeam season="2015" teamId="0920" abbr="CIN" cityState="Cincinnati" fullName="Cincinnati Bengals" nick="Bengals" teamType="TEAM" conferenceAbbr="AFC" divisionAbbr="ACN"/><site siteId="3530" siteCity="Cincinnati" siteState="OH" siteFullname="Paul Brown Stadium" roofType="OUTDOOR"/><localAwayTv>FOX (local)</localAwayTv><localAwayRadio>WBBM (English) | TBA (Español)</localAwayRadio></gameSchedule><gameSchedule season="2015" seasonType="PRE" week="3" gameId="2015082958" gameKey="56802" gameDate="08/29/2015" gameTimeEastern="20:00:00" gameTimeLocal="19:00:00" isoTime="2015-08-29T17:00:00-07:00" homeTeamId="1800" visitorTeamId="3700" homeTeamAbbr="GB" visitorTeamAbbr="PHI" homeDisplayName="Green Bay Packers" visitorDisplayName="Philadelphia Eagles" homeNickname="Packers" visitorNickname="Eagles" gameType="PRE" weekNameAbbr="P3" weekName="Preseason Week 3"><visitorTeam season="2015" teamId="3700" abbr="PHI" cityState="Philadelphia" fullName="Philadelphia Eagles" nick="Eagles" teamType="TEAM" conferenceAbbr="NFC" divisionAbbr="NCE"/><homeTeam season="2015" teamId="1800" abbr="GB" cityState="Green Bay" fullName="Green Bay Packers" nick="Packers" teamType="TEAM" conferenceAbbr="NFC" divisionAbbr="NCN"/><site siteId="2606" siteCity="Green Bay" siteState="WI" siteFullname="Lambeau Field" roofType="OUTDOOR"/><radioSatelliteAway>118</radioSatelliteAway></gameSchedule><gameSchedule season="2015" seasonType="PRE" week="3" gameId="2015082959" gameKey="56803" gameDate="08/29/2015" gameTimeEastern="20:00:00" gameTimeLocal="19:00:00" isoTime="2015-08-29T17:00:00-07:00" homeTeamId="2510" visitorTeamId="2200" homeTeamAbbr="STL" visitorTeamAbbr="IND" homeDisplayName="St. Louis Rams" visitorDisplayName="Indianapolis Colts" homeNickname="Rams" visitorNickname="Colts" gameType="PRE" weekNameAbbr="P3" weekName="Preseason Week 3"><visitorTeam season="2015" teamId="2200" abbr="IND" cityState="Indianapolis" fullName="Indianapolis Colts" nick="Colts" teamType="TEAM" conferenceAbbr="AFC" divisionAbbr="ACS"/><homeTeam season="2015" teamId="2510" abbr="STL" cityState="St. Louis" fullName="St. Louis Rams" nick="Rams" teamType="TEAM" conferenceAbbr="NFC" divisionAbbr="NCW"/><site siteId="5189" siteCity="St. Louis" siteState="MO" siteFullname="Edward Jones Dome" roofType="INDOOR"/><localAwayTv>FOX59</localAwayTv></gameSchedule><gameSchedule season="2015" seasonType="PRE" week="3" gameId="2015082960" gameKey="56804" gameDate="08/29/2015" gameTimeEastern="20:00:00" gameTimeLocal="17:00:00" isoTime="2015-08-29T17:00:00-07:00" homeTeamId="4400" visitorTeamId="4600" homeTeamAbbr="SD" visitorTeamAbbr="SEA" homeDisplayName="San Diego Chargers" visitorDisplayName="Seattle Seahawks" homeNickname="Chargers" visitorNickname="Seahawks" gameType="PRE" weekNameAbbr="P3" weekName="Preseason Week 3"><visitorTeam season="2015" teamId="4600" abbr="SEA" cityState="Seattle" fullName="Seattle Seahawks" nick="Seahawks" teamType="TEAM" conferenceAbbr="NFC" divisionAbbr="NCW"/><homeTeam season="2015" teamId="4400" abbr="SD" cityState="San Diego" fullName="San Diego Chargers" nick="Chargers" teamType="TEAM" conferenceAbbr="AFC" divisionAbbr="ACW"/><site siteId="4200" siteCity="San Diego" siteState="CA" siteFullname="Qualcomm Stadium" roofType="OUTDOOR"/><networkChannel>CBS</networkChannel><localHomeRadio>ROCK 105.3</localHomeRadio></gameSchedule><gameSchedule season="2015" seasonType="PRE" week="3" gameId="2015082961" gameKey="56805" gameDate="08/29/2015" gameTimeEastern="21:00:00" gameTimeLocal="19:00:00" isoTime="2015-08-29T18:00:00-07:00" homeTeamId="1400" visitorTeamId="4500" homeTeamAbbr="DEN" visitorTeamAbbr="SF" homeDisplayName="Denver Broncos" visitorDisplayName="San Francisco 49ers" homeNickname="Broncos" visitorNickname="49ers" gameType="PRE" weekNameAbbr="P3" weekName="Preseason Week 3"><visitorTeam season="2015" teamId="4500" abbr="SF" cityState="San Francisco" fullName="San Francisco 49ers" nick="49ers" teamType="TEAM" conferenceAbbr="NFC" divisionAbbr="NCW"/><homeTeam season="2015" teamId="1400" abbr="DEN" cityState="Denver" fullName="Denver Broncos" nick="Broncos" teamType="TEAM" conferenceAbbr="AFC" divisionAbbr="ACW"/><site siteId="5786" siteCity="Denver" siteState="CO" siteFullname="Sports Authority Field at Mile High" roofType="OUTDOOR"/></gameSchedule><gameSchedule season="2015" seasonType="PRE" week="3" gameId="2015083051" gameKey="56806" gameDate="08/30/2015" gameTimeEastern="16:00:00" gameTimeLocal="15:00:00" isoTime="2015-08-30T13:00:00-07:00" homeTeamId="3300" visitorTeamId="2120" homeTeamAbbr="NO" visitorTeamAbbr="HOU" homeDisplayName="New Orleans Saints" visitorDisplayName="Houston Texans" homeNickname="Saints" visitorNickname="Texans" gameType="PRE" weekNameAbbr="P3" weekName="Preseason Week 3"><visitorTeam season="2015" teamId="2120" abbr="HOU" cityState="Houston" fullName="Houston Texans" nick="Texans" teamType="TEAM" conferenceAbbr="AFC" divisionAbbr="ACS"/><homeTeam season="2015" teamId="3300" abbr="NO" cityState="New Orleans" fullName="New Orleans Saints" nick="Saints" teamType="TEAM" conferenceAbbr="NFC" divisionAbbr="NCS"/><site siteId="2870" siteCity="New Orleans" siteState="LA" siteFullname="Mercedes-Benz Superdome" roofType="INDOOR"/><networkChannel>FOX</networkChannel></gameSchedule><gameSchedule season="2015" seasonType="PRE" week="3" gameId="2015083052" gameKey="56807" gameDate="08/30/2015" gameTimeEastern="20:00:00" gameTimeLocal="17:00:00" isoTime="2015-08-30T17:00:00-07:00" homeTeamId="2520" visitorTeamId="3800" homeTeamAbbr="OAK" visitorTeamAbbr="ARI" homeDisplayName="Oakland Raiders" visitorDisplayName="Arizona Cardinals" homeNickname="Raiders" visitorNickname="Cardinals" gameType="PRE" weekNameAbbr="P3" weekName="Preseason Week 3"><visitorTeam season="2015" teamId="3800" abbr="ARI" cityState="Arizona" fullName="Arizona Cardinals" nick="Cardinals" teamType="TEAM" conferenceAbbr="NFC" divisionAbbr="NCW"/><homeTeam season="2015" teamId="2520" abbr="OAK" cityState="Oakland" fullName="Oakland Raiders" nick="Raiders" teamType="TEAM" conferenceAbbr="AFC" divisionAbbr="ACW"/><site siteId="3225" siteCity="Oakland" siteState="CA" siteFullname="O.co Coliseum" roofType="OUTDOOR"/><networkChannel>NBC</networkChannel></gameSchedule><gameSchedule season="2015" seasonType="PRE" week="4" gameId="2015090351" gameKey="56808" gameDate="09/03/2015" gameTimeEastern="19:00:00" gameTimeLocal="19:00:00" isoTime="2015-09-03T16:00:00-07:00" homeTeamId="0200" visitorTeamId="0325" homeTeamAbbr="ATL" visitorTeamAbbr="BAL" homeDisplayName="Atlanta Falcons" visitorDisplayName="Baltimore Ravens" homeNickname="Falcons" visitorNickname="Ravens" gameType="PRE" weekNameAbbr="P4" weekName="Preseason Week 4"><visitorTeam season="2015" teamId="0325" abbr="BAL" cityState="Baltimore" fullName="Baltimore Ravens" nick="Ravens" teamType="TEAM" conferenceAbbr="AFC" divisionAbbr="ACN"/><homeTeam season="2015" teamId="0200" abbr="ATL" cityState="Atlanta" fullName="Atlanta Falcons" nick="Falcons" teamType="TEAM" conferenceAbbr="NFC" divisionAbbr="NCS"/><site siteId="2053" siteCity="Atlanta" siteState="GA" siteFullname="Georgia Dome" roofType="INDOOR"/></gameSchedule><gameSchedule season="2015" seasonType="PRE" week="4" gameId="2015090352" gameKey="56809" gameDate="09/03/2015" gameTimeEastern="19:00:00" gameTimeLocal="18:00:00" isoTime="2015-09-03T16:00:00-07:00" homeTeamId="1800" visitorTeamId="3300" homeTeamAbbr="GB" visitorTeamAbbr="NO" homeDisplayName="Green Bay Packers" visitorDisplayName="New Orleans Saints" homeNickname="Packers" visitorNickname="Saints" gameType="PRE" weekNameAbbr="P4" weekName="Preseason Week 4"><visitorTeam season="2015" teamId="3300" abbr="NO" cityState="New Orleans" fullName="New Orleans Saints" nick="Saints" teamType="TEAM" conferenceAbbr="NFC" divisionAbbr="NCS"/><homeTeam season="2015" teamId="1800" abbr="GB" cityState="Green Bay" fullName="Green Bay Packers" nick="Packers" teamType="TEAM" conferenceAbbr="NFC" divisionAbbr="NCN"/><site siteId="2606" siteCity="Green Bay" siteState="WI" siteFullname="Lambeau Field" roofType="OUTDOOR"/></gameSchedule><gameSchedule season="2015" seasonType="PRE" week="4" gameId="2015090353" gameKey="56810" gameDate="09/03/2015" gameTimeEastern="19:00:00" gameTimeLocal="19:00:00" isoTime="2015-09-03T16:00:00-07:00" homeTeamId="2200" visitorTeamId="0920" homeTeamAbbr="IND" visitorTeamAbbr="CIN" homeDisplayName="Indianapolis Colts" visitorDisplayName="Cincinnati Bengals" homeNickname="Colts" visitorNickname="Bengals" gameType="PRE" weekNameAbbr="P4" weekName="Preseason Week 4"><visitorTeam season="2015" teamId="0920" abbr="CIN" cityState="Cincinnati" fullName="Cincinnati Bengals" nick="Bengals" teamType="TEAM" conferenceAbbr="AFC" divisionAbbr="ACN"/><homeTeam season="2015" teamId="2200" abbr="IND" cityState="Indianapolis" fullName="Indianapolis Colts" nick="Colts" teamType="TEAM" conferenceAbbr="AFC" divisionAbbr="ACS"/><site siteId="2878" siteCity="Indianapolis" siteState="IN" siteFullname="Lucas Oil Stadium" roofType="INDOOR"/><localHomeTv>FOX59</localHomeTv></gameSchedule><gameSchedule season="2015" seasonType="PRE" week="4" gameId="2015090354" gameKey="56811" gameDate="09/03/2015" gameTimeEastern="19:00:00" gameTimeLocal="19:00:00" isoTime="2015-09-03T16:00:00-07:00" homeTeamId="2700" visitorTeamId="4900" homeTeamAbbr="MIA" visitorTeamAbbr="TB" homeDisplayName="Miami Dolphins" visitorDisplayName="Tampa Bay Buccaneers" homeNickname="Dolphins" visitorNickname="Buccaneers" gameType="PRE" weekNameAbbr="P4" weekName="Preseason Week 4"><visitorTeam season="2015" teamId="4900" abbr="TB" cityState="Tampa Bay" fullName="Tampa Bay Buccaneers" nick="Buccaneers" teamType="TEAM" conferenceAbbr="NFC" divisionAbbr="NCS"/><homeTeam season="2015" teamId="2700" abbr="MIA" cityState="Miami" fullName="Miami Dolphins" nick="Dolphins" teamType="TEAM" conferenceAbbr="AFC" divisionAbbr="ACE"/><site siteId="2475" siteCity="Miami Gardens" siteState="FL" siteFullname="Sun Life Stadium" roofType="OUTDOOR"/></gameSchedule><gameSchedule season="2015" seasonType="PRE" week="4" gameId="2015090355" gameKey="56812" gameDate="09/03/2015" gameTimeEastern="19:00:00" gameTimeLocal="19:00:00" isoTime="2015-09-03T16:00:00-07:00" homeTeamId="3430" visitorTeamId="3700" homeTeamAbbr="NYJ" visitorTeamAbbr="PHI" homeDisplayName="New York Jets" visitorDisplayName="Philadelphia Eagles" homeNickname="Jets" visitorNickname="Eagles" gameType="PRE" weekNameAbbr="P4" weekName="Preseason Week 4"><visitorTeam season="2015" teamId="3700" abbr="PHI" cityState="Philadelphia" fullName="Philadelphia Eagles" nick="Eagles" teamType="TEAM" conferenceAbbr="NFC" divisionAbbr="NCE"/><homeTeam season="2015" teamId="3430" abbr="NYJ" cityState="New York Jets" fullName="New York Jets" nick="Jets" teamType="TEAM" conferenceAbbr="AFC" divisionAbbr="ACE"/><site siteId="3757" siteCity="East Rutherford" siteState="NJ" siteFullname="MetLife Stadium" roofType="OUTDOOR"/></gameSchedule><gameSchedule season="2015" seasonType="PRE" week="4" gameId="2015090356" gameKey="56813" gameDate="09/03/2015" gameTimeEastern="19:30:00" gameTimeLocal="19:30:00" isoTime="2015-09-03T16:30:00-07:00" homeTeamId="1540" visitorTeamId="0610" homeTeamAbbr="DET" visitorTeamAbbr="BUF" homeDisplayName="Detroit Lions" visitorDisplayName="Buffalo Bills" homeNickname="Lions" visitorNickname="Bills" gameType="PRE" weekNameAbbr="P4" weekName="Preseason Week 4"><visitorTeam season="2015" teamId="0610" abbr="BUF" cityState="Buffalo" fullName="Buffalo Bills" nick="Bills" teamType="TEAM" conferenceAbbr="AFC" divisionAbbr="ACE"/><homeTeam season="2015" teamId="1540" abbr="DET" cityState="Detroit" fullName="Detroit Lions" nick="Lions" teamType="TEAM" conferenceAbbr="NFC" divisionAbbr="NCN"/><site siteId="2026" siteCity="Detroit" siteState="MI" siteFullname="Ford Field" roofType="INDOOR"/></gameSchedule><gameSchedule season="2015" seasonType="PRE" week="4" gameId="2015090357" gameKey="56814" gameDate="09/03/2015" gameTimeEastern="19:30:00" gameTimeLocal="19:30:00" isoTime="2015-09-03T16:30:00-07:00" homeTeamId="3200" visitorTeamId="3410" homeTeamAbbr="NE" visitorTeamAbbr="NYG" homeDisplayName="New England Patriots" visitorDisplayName="New York Giants" homeNickname="Patriots" visitorNickname="Giants" gameType="PRE" weekNameAbbr="P4" weekName="Preseason Week 4"><visitorTeam season="2015" teamId="3410" abbr="NYG" cityState="New York Giants" fullName="New York Giants" nick="Giants" teamType="TEAM" conferenceAbbr="NFC" divisionAbbr="NCE"/><homeTeam season="2015" teamId="3200" abbr="NE" cityState="New England" fullName="New England Patriots" nick="Patriots" teamType="TEAM" conferenceAbbr="AFC" divisionAbbr="ACE"/><site siteId="1065" siteCity="Foxborough" siteState="MA" siteFullname="Gillette Stadium" roofType="OUTDOOR"/><localHomeTv>WBZ / Patriots Preseason Network</localHomeTv><localAwayTv>WNBC 4 NY</localAwayTv><localHomeRadio>98.5 FM The Sports Hub</localHomeRadio><localAwayRadio>WFAN</localAwayRadio></gameSchedule><gameSchedule season="2015" seasonType="PRE" week="4" gameId="2015090359" gameKey="56816" gameDate="09/03/2015" gameTimeEastern="19:30:00" gameTimeLocal="19:30:00" isoTime="2015-09-03T16:30:00-07:00" homeTeamId="5110" visitorTeamId="2250" homeTeamAbbr="WAS" visitorTeamAbbr="JAC" homeDisplayName="Washington Redskins" visitorDisplayName="Jacksonville Jaguars" homeNickname="Redskins" visitorNickname="Jaguars" gameType="PRE" weekNameAbbr="P4" weekName="Preseason Week 4"><visitorTeam season="2015" teamId="2250" abbr="JAC" cityState="Jacksonville" fullName="Jacksonville Jaguars" nick="Jaguars" teamType="TEAM" conferenceAbbr="AFC" divisionAbbr="ACS"/><homeTeam season="2015" teamId="5110" abbr="WAS" cityState="Washington" fullName="Washington Redskins" nick="Redskins" teamType="TEAM" conferenceAbbr="NFC" divisionAbbr="NCE"/><site siteId="2389" siteCity="Landover" siteState="MD" siteFullname="FedExField" roofType="OUTDOOR"/><localHomeTv>NBC CSN</localHomeTv></gameSchedule><gameSchedule season="2015" seasonType="PRE" week="4" gameId="2015090358" gameKey="56815" gameDate="09/03/2015" gameTimeEastern="19:30:00" gameTimeLocal="19:30:00" isoTime="2015-09-03T16:30:00-07:00" homeTeamId="3900" visitorTeamId="0750" homeTeamAbbr="PIT" visitorTeamAbbr="CAR" homeDisplayName="Pittsburgh Steelers" visitorDisplayName="Carolina Panthers" homeNickname="Steelers" visitorNickname="Panthers" gameType="PRE" weekNameAbbr="P4" weekName="Preseason Week 4"><visitorTeam season="2015" teamId="0750" abbr="CAR" cityState="Carolina" fullName="Carolina Panthers" nick="Panthers" teamType="TEAM" conferenceAbbr="NFC" divisionAbbr="NCS"/><homeTeam season="2015" teamId="3900" abbr="PIT" cityState="Pittsburgh" fullName="Pittsburgh Steelers" nick="Steelers" teamType="TEAM" conferenceAbbr="AFC" divisionAbbr="ACN"/><site siteId="5411" siteCity="Pittsburgh" siteState="PA" siteFullname="Heinz Field" roofType="OUTDOOR"/></gameSchedule><gameSchedule season="2015" seasonType="PRE" week="4" gameId="2015090360" gameKey="56817" gameDate="09/03/2015" gameTimeEastern="20:00:00" gameTimeLocal="19:00:00" isoTime="2015-09-03T17:00:00-07:00" homeTeamId="0810" visitorTeamId="1050" homeTeamAbbr="CHI" visitorTeamAbbr="CLE" homeDisplayName="Chicago Bears" visitorDisplayName="Cleveland Browns" homeNickname="Bears" visitorNickname="Browns" gameType="PRE" weekNameAbbr="P4" weekName="Preseason Week 4"><visitorTeam season="2015" teamId="1050" abbr="CLE" cityState="Cleveland" fullName="Cleveland Browns" nick="Browns" teamType="TEAM" conferenceAbbr="AFC" divisionAbbr="ACN"/><homeTeam season="2015" teamId="0810" abbr="CHI" cityState="Chicago" fullName="Chicago Bears" nick="Bears" teamType="TEAM" conferenceAbbr="NFC" divisionAbbr="NCN"/><site siteId="4620" siteCity="Chicago" siteState="IL" siteFullname="Soldier Field" roofType="OUTDOOR"/><localHomeTv>FOX (local)</localHomeTv><localHomeRadio>WBBM (English) | TBA (Español)</localHomeRadio></gameSchedule><gameSchedule season="2015" seasonType="PRE" week="4" gameId="2015090361" gameKey="56818" gameDate="09/03/2015" gameTimeEastern="20:00:00" gameTimeLocal="19:00:00" isoTime="2015-09-03T17:00:00-07:00" homeTeamId="1200" visitorTeamId="2120" homeTeamAbbr="DAL" visitorTeamAbbr="HOU" homeDisplayName="Dallas Cowboys" visitorDisplayName="Houston Texans" homeNickname="Cowboys" visitorNickname="Texans" gameType="PRE" weekNameAbbr="P4" weekName="Preseason Week 4"><visitorTeam season="2015" teamId="2120" abbr="HOU" cityState="Houston" fullName="Houston Texans" nick="Texans" teamType="TEAM" conferenceAbbr="AFC" divisionAbbr="ACS"/><homeTeam season="2015" teamId="1200" abbr="DAL" cityState="Dallas" fullName="Dallas Cowboys" nick="Cowboys" teamType="TEAM" conferenceAbbr="NFC" divisionAbbr="NCE"/><site siteId="4948" siteCity="Arlington" siteState="TX" siteFullname="AT&amp;T Stadium" roofType="RETRACTABLE"/></gameSchedule><gameSchedule season="2015" seasonType="PRE" week="4" gameId="2015090363" gameKey="56820" gameDate="09/03/2015" gameTimeEastern="20:00:00" gameTimeLocal="19:00:00" isoTime="2015-09-03T17:00:00-07:00" homeTeamId="2100" visitorTeamId="3000" homeTeamAbbr="TEN" visitorTeamAbbr="MIN" homeDisplayName="Tennessee Titans" visitorDisplayName="Minnesota Vikings" homeNickname="Titans" visitorNickname="Vikings" gameType="PRE" weekNameAbbr="P4" weekName="Preseason Week 4"><visitorTeam season="2015" teamId="3000" abbr="MIN" cityState="Minnesota" fullName="Minnesota Vikings" nick="Vikings" teamType="TEAM" conferenceAbbr="NFC" divisionAbbr="NCN"/><homeTeam season="2015" teamId="2100" abbr="TEN" cityState="Tennessee" fullName="Tennessee Titans" nick="Titans" teamType="TEAM" conferenceAbbr="AFC" divisionAbbr="ACS"/><site siteId="2350" siteCity="Nashville" siteState="TN" siteFullname="Nissan Stadium" roofType="OUTDOOR"/></gameSchedule><gameSchedule season="2015" seasonType="PRE" week="4" gameId="2015090362" gameKey="56819" gameDate="09/03/2015" gameTimeEastern="20:00:00" gameTimeLocal="19:00:00" isoTime="2015-09-03T17:00:00-07:00" homeTeamId="2510" visitorTeamId="2310" homeTeamAbbr="STL" visitorTeamAbbr="KC" homeDisplayName="St. Louis Rams" visitorDisplayName="Kansas City Chiefs" homeNickname="Rams" visitorNickname="Chiefs" gameType="PRE" weekNameAbbr="P4" weekName="Preseason Week 4"><visitorTeam season="2015" teamId="2310" abbr="KC" cityState="Kansas City" fullName="Kansas City Chiefs" nick="Chiefs" teamType="TEAM" conferenceAbbr="AFC" divisionAbbr="ACW"/><homeTeam season="2015" teamId="2510" abbr="STL" cityState="St. Louis" fullName="St. Louis Rams" nick="Rams" teamType="TEAM" conferenceAbbr="NFC" divisionAbbr="NCW"/><site siteId="5189" siteCity="St. Louis" siteState="MO" siteFullname="Edward Jones Dome" roofType="INDOOR"/></gameSchedule><gameSchedule season="2015" seasonType="PRE" week="4" gameId="2015090364" gameKey="56821" gameDate="09/03/2015" gameTimeEastern="21:00:00" gameTimeLocal="19:00:00" isoTime="2015-09-03T18:00:00-07:00" homeTeamId="1400" visitorTeamId="3800" homeTeamAbbr="DEN" visitorTeamAbbr="ARI" homeDisplayName="Denver Broncos" visitorDisplayName="Arizona Cardinals" homeNickname="Broncos" visitorNickname="Cardinals" gameType="PRE" weekNameAbbr="P4" weekName="Preseason Week 4"><visitorTeam season="2015" teamId="3800" abbr="ARI" cityState="Arizona" fullName="Arizona Cardinals" nick="Cardinals" teamType="TEAM" conferenceAbbr="NFC" divisionAbbr="NCW"/><homeTeam season="2015" teamId="1400" abbr="DEN" cityState="Denver" fullName="Denver Broncos" nick="Broncos" teamType="TEAM" conferenceAbbr="AFC" divisionAbbr="ACW"/><site siteId="5786" siteCity="Denver" siteState="CO" siteFullname="Sports Authority Field at Mile High" roofType="OUTDOOR"/></gameSchedule><gameSchedule season="2015" seasonType="PRE" week="4" gameId="2015090365" gameKey="56822" gameDate="09/03/2015" gameTimeEastern="22:00:00" gameTimeLocal="19:00:00" isoTime="2015-09-03T19:00:00-07:00" homeTeamId="4500" visitorTeamId="4400" homeTeamAbbr="SF" visitorTeamAbbr="SD" homeDisplayName="San Francisco 49ers" visitorDisplayName="San Diego Chargers" homeNickname="49ers" visitorNickname="Chargers" gameType="PRE" weekNameAbbr="P4" weekName="Preseason Week 4"><visitorTeam season="2015" teamId="4400" abbr="SD" cityState="San Diego" fullName="San Diego Chargers" nick="Chargers" teamType="TEAM" conferenceAbbr="AFC" divisionAbbr="ACW"/><homeTeam season="2015" teamId="4500" abbr="SF" cityState="San Francisco" fullName="San Francisco 49ers" nick="49ers" teamType="TEAM" conferenceAbbr="NFC" divisionAbbr="NCW"/><site siteId="2099" siteCity="Santa Clara" siteState="CA" siteFullname="Levi's Stadium" roofType="OUTDOOR"/><localAwayTv>KFMB 8</localAwayTv><localAwayRadio>ROCK 105.3</localAwayRadio></gameSchedule><gameSchedule season="2015" seasonType="PRE" week="4" gameId="2015090366" gameKey="56823" gameDate="09/03/2015" gameTimeEastern="22:00:00" gameTimeLocal="19:00:00" isoTime="2015-09-03T19:00:00-07:00" homeTeamId="4600" visitorTeamId="2520" homeTeamAbbr="SEA" visitorTeamAbbr="OAK" homeDisplayName="Seattle Seahawks" visitorDisplayName="Oakland Raiders" homeNickname="Seahawks" visitorNickname="Raiders" gameType="PRE" weekNameAbbr="P4" weekName="Preseason Week 4"><visitorTeam season="2015" teamId="2520" abbr="OAK" cityState="Oakland" fullName="Oakland Raiders" nick="Raiders" teamType="TEAM" conferenceAbbr="AFC" divisionAbbr="ACW"/><homeTeam season="2015" teamId="4600" abbr="SEA" cityState="Seattle" fullName="Seattle Seahawks" nick="Seahawks" teamType="TEAM" conferenceAbbr="NFC" divisionAbbr="NCW"/><site siteId="5315" siteCity="Seattle" siteState="WA" siteFullname="CenturyLink Field" roofType="OUTDOOR"/><localHomeTv>Q13 FOX</localHomeTv></gameSchedule><gameSchedule season="2015" seasonType="REG" week="1" gameId="2015091000" gameKey="56503" gameDate="09/10/2015" gameTimeEastern="20:30:00" gameTimeLocal="20:30:00" isoTime="2015-09-10T17:30:00-07:00" homeTeamId="3200" visitorTeamId="3900" homeTeamAbbr="NE" visitorTeamAbbr="PIT" homeDisplayName="New England Patriots" visitorDisplayName="Pittsburgh Steelers" homeNickname="Patriots" visitorNickname="Steelers" gameType="REG" weekNameAbbr="Week 1" weekName="Week 1"><visitorTeam season="2015" teamId="3900" abbr="PIT" cityState="Pittsburgh" fullName="Pittsburgh Steelers" nick="Steelers" teamType="TEAM" conferenceAbbr="AFC" divisionAbbr="ACN"/><homeTeam season="2015" teamId="3200" abbr="NE" cityState="New England" fullName="New England Patriots" nick="Patriots" teamType="TEAM" conferenceAbbr="AFC" divisionAbbr="ACE"/><site siteId="1065" siteCity="Foxborough" siteState="MA" siteFullname="Gillette Stadium" roofType="OUTDOOR"/><networkChannel>NBC</networkChannel><localHomeTv>/ WHDH</localHomeTv><localHomeRadio>98.5 FM The Sports Hub</localHomeRadio></gameSchedule><gameSchedule season="2015" seasonType="REG" week="1" gameId="2015091300" gameKey="56505" gameDate="09/13/2015" gameTimeEastern="13:00:00" gameTimeLocal="12:00:00" isoTime="2015-09-13T10:00:00-07:00" homeTeamId="0810" visitorTeamId="1800" homeTeamAbbr="CHI" visitorTeamAbbr="GB" homeDisplayName="Chicago Bears" visitorDisplayName="Green Bay Packers" homeNickname="Bears" visitorNickname="Packers" gameType="REG" weekNameAbbr="Week 1" weekName="Week 1"><visitorTeam season="2015" teamId="1800" abbr="GB" cityState="Green Bay" fullName="Green Bay Packers" nick="Packers" teamType="TEAM" conferenceAbbr="NFC" divisionAbbr="NCN"/><homeTeam season="2015" teamId="0810" abbr="CHI" cityState="Chicago" fullName="Chicago Bears" nick="Bears" teamType="TEAM" conferenceAbbr="NFC" divisionAbbr="NCN"/><site siteId="4620" siteCity="Chicago" siteState="IL" siteFullname="Soldier Field" roofType="OUTDOOR"/><networkChannel>FOX</networkChannel><localHomeRadio>WBBM (English) | TBA (Español)</localHomeRadio></gameSchedule><gameSchedule season="2015" seasonType="REG" week="1" gameId="2015091306" gameKey="56506" gameDate="09/13/2015" gameTimeEastern="13:00:00" gameTimeLocal="12:00:00" isoTime="2015-09-13T10:00:00-07:00" homeTeamId="2120" visitorTeamId="2310" homeTeamAbbr="HOU" visitorTeamAbbr="KC" homeDisplayName="Houston Texans" visitorDisplayName="Kansas City Chiefs" homeNickname="Texans" visitorNickname="Chiefs" gameType="REG" weekNameAbbr="Week 1" weekName="Week 1"><visitorTeam season="2015" teamId="2310" abbr="KC" cityState="Kansas City" fullName="Kansas City Chiefs" nick="Chiefs" teamType="TEAM" conferenceAbbr="AFC" divisionAbbr="ACW"/><homeTeam season="2015" teamId="2120" abbr="HOU" cityState="Houston" fullName="Houston Texans" nick="Texans" teamType="TEAM" conferenceAbbr="AFC" divisionAbbr="ACS"/><site siteId="3698" siteCity="Houston" siteState="TX" siteFullname="NRG Stadium" roofType="OUTDOOR"/><networkChannel>CBS</networkChannel></gameSchedule><gameSchedule season="2015" seasonType="REG" week="1" gameId="2015091305" gameKey="56508" gameDate="09/13/2015" gameTimeEastern="13:00:00" gameTimeLocal="13:00:00" isoTime="2015-09-13T10:00:00-07:00" homeTeamId="3430" visitorTeamId="1050" homeTeamAbbr="NYJ" visitorTeamAbbr="CLE" homeDisplayName="New York Jets" visitorDisplayName="Cleveland Browns" homeNickname="Jets" visitorNickname="Browns" gameType="REG" weekNameAbbr="Week 1" weekName="Week 1"><visitorTeam season="2015" teamId="1050" abbr="CLE" cityState="Cleveland" fullName="Cleveland Browns" nick="Browns" teamType="TEAM" conferenceAbbr="AFC" divisionAbbr="ACN"/><homeTeam season="2015" teamId="3430" abbr="NYJ" cityState="New York Jets" fullName="New York Jets" nick="Jets" teamType="TEAM" conferenceAbbr="AFC" divisionAbbr="ACE"/><site siteId="3757" siteCity="East Rutherford" siteState="NJ" siteFullname="MetLife Stadium" roofType="OUTDOOR"/><networkChannel>CBS</networkChannel></gameSchedule><gameSchedule season="2015" seasonType="REG" week="1" gameId="2015091304" gameKey="56504" gameDate="09/13/2015" gameTimeEastern="13:00:00" gameTimeLocal="13:00:00" isoTime="2015-09-13T10:00:00-07:00" homeTeamId="0610" visitorTeamId="2200" homeTeamAbbr="BUF" visitorTeamAbbr="IND" homeDisplayName="Buffalo Bills" visitorDisplayName="Indianapolis Colts" homeNickname="Bills" visitorNickname="Colts" gameType="REG" weekNameAbbr="Week 1" weekName="Week 1"><visitorTeam season="2015" teamId="2200" abbr="IND" cityState="Indianapolis" fullName="Indianapolis Colts" nick="Colts" teamType="TEAM" conferenceAbbr="AFC" divisionAbbr="ACS"/><homeTeam season="2015" teamId="0610" abbr="BUF" cityState="Buffalo" fullName="Buffalo Bills" nick="Bills" teamType="TEAM" conferenceAbbr="AFC" divisionAbbr="ACE"/><site siteId="3770" siteCity="Orchard Park" siteState="NY" siteFullname="Ralph Wilson Stadium" roofType="OUTDOOR"/><networkChannel>CBS</networkChannel></gameSchedule><gameSchedule season="2015" seasonType="REG" week="1" gameId="2015091303" gameKey="56510" gameDate="09/13/2015" gameTimeEastern="13:00:00" gameTimeLocal="13:00:00" isoTime="2015-09-13T10:00:00-07:00" homeTeamId="5110" visitorTeamId="2700" homeTeamAbbr="WAS" visitorTeamAbbr="MIA" homeDisplayName="Washington Redskins" visitorDisplayName="Miami Dolphins" homeNickname="Redskins" visitorNickname="Dolphins" gameType="REG" weekNameAbbr="Week 1" weekName="Week 1"><visitorTeam season="2015" teamId="2700" abbr="MIA" cityState="Miami" fullName="Miami Dolphins" nick="Dolphins" teamType="TEAM" conferenceAbbr="AFC" divisionAbbr="ACE"/><homeTeam season="2015" teamId="5110" abbr="WAS" cityState="Washington" fullName="Washington Redskins" nick="Redskins" teamType="TEAM" conferenceAbbr="NFC" divisionAbbr="NCE"/><site siteId="2389" siteCity="Landover" siteState="MD" siteFullname="FedExField" roofType="OUTDOOR"/><networkChannel>CBS</networkChannel><localHomeTv>CBS</localHomeTv></gameSchedule><gameSchedule season="2015" seasonType="REG" week="1" gameId="2015091302" gameKey="56507" gameDate="09/13/2015" gameTimeEastern="13:00:00" gameTimeLocal="13:00:00" isoTime="2015-09-13T10:00:00-07:00" homeTeamId="2250" visitorTeamId="0750" homeTeamAbbr="JAC" visitorTeamAbbr="CAR" homeDisplayName="Jacksonville Jaguars" visitorDisplayName="Carolina Panthers" homeNickname="Jaguars" visitorNickname="Panthers" gameType="REG" weekNameAbbr="Week 1" weekName="Week 1"><visitorTeam season="2015" teamId="0750" abbr="CAR" cityState="Carolina" fullName="Carolina Panthers" nick="Panthers" teamType="TEAM" conferenceAbbr="NFC" divisionAbbr="NCS"/><homeTeam season="2015" teamId="2250" abbr="JAC" cityState="Jacksonville" fullName="Jacksonville Jaguars" nick="Jaguars" teamType="TEAM" conferenceAbbr="AFC" divisionAbbr="ACS"/><site siteId="2049" siteCity="Jacksonville" siteState="FL" siteFullname="EverBank Field" roofType="OUTDOOR"/><networkChannel>FOX</networkChannel></gameSchedule><gameSchedule season="2015" seasonType="REG" week="1" gameId="2015091301" gameKey="56509" gameDate="09/13/2015" gameTimeEastern="13:00:00" gameTimeLocal="12:00:00" isoTime="2015-09-13T10:00:00-07:00" homeTeamId="2510" visitorTeamId="4600" homeTeamAbbr="STL" visitorTeamAbbr="SEA" homeDisplayName="St. Louis Rams" visitorDisplayName="Seattle Seahawks" homeNickname="Rams" visitorNickname="Seahawks" gameType="REG" weekNameAbbr="Week 1" weekName="Week 1"><visitorTeam season="2015" teamId="4600" abbr="SEA" cityState="Seattle" fullName="Seattle Seahawks" nick="Seahawks" teamType="TEAM" conferenceAbbr="NFC" divisionAbbr="NCW"/><homeTeam season="2015" teamId="2510" abbr="STL" cityState="St. Louis" fullName="St. Louis Rams" nick="Rams" teamType="TEAM" conferenceAbbr="NFC" divisionAbbr="NCW"/><site siteId="5189" siteCity="St. Louis" siteState="MO" siteFullname="Edward Jones Dome" roofType="INDOOR"/><networkChannel>FOX</networkChannel></gameSchedule><gameSchedule season="2015" seasonType="REG" week="1" gameId="2015091308" gameKey="56512" gameDate="09/13/2015" gameTimeEastern="16:05:00" gameTimeLocal="13:05:00" isoTime="2015-09-13T13:05:00-07:00" homeTeamId="4400" visitorTeamId="1540" homeTeamAbbr="SD" visitorTeamAbbr="DET" homeDisplayName="San Diego Chargers" visitorDisplayName="Detroit Lions" homeNickname="Chargers" visitorNickname="Lions" gameType="REG" weekNameAbbr="Week 1" weekName="Week 1"><visitorTeam season="2015" teamId="1540" abbr="DET" cityState="Detroit" fullName="Detroit Lions" nick="Lions" teamType="TEAM" conferenceAbbr="NFC" divisionAbbr="NCN"/><homeTeam season="2015" teamId="4400" abbr="SD" cityState="San Diego" fullName="San Diego Chargers" nick="Chargers" teamType="TEAM" conferenceAbbr="AFC" divisionAbbr="ACW"/><site siteId="4200" siteCity="San Diego" siteState="CA" siteFullname="Qualcomm Stadium" roofType="OUTDOOR"/><networkChannel>FOX</networkChannel><localHomeRadio>ROCK 105.3</localHomeRadio></gameSchedule><gameSchedule season="2015" seasonType="REG" week="1" gameId="2015091307" gameKey="56511" gameDate="09/13/2015" gameTimeEastern="16:05:00" gameTimeLocal="14:05:00" isoTime="2015-09-13T13:05:00-07:00" homeTeamId="3800" visitorTeamId="3300" homeTeamAbbr="ARI" visitorTeamAbbr="NO" homeDisplayName="Arizona Cardinals" visitorDisplayName="New Orleans Saints" homeNickname="Cardinals" visitorNickname="Saints" gameType="REG" weekNameAbbr="Week 1" weekName="Week 1"><visitorTeam season="2015" teamId="3300" abbr="NO" cityState="New Orleans" fullName="New Orleans Saints" nick="Saints" teamType="TEAM" conferenceAbbr="NFC" divisionAbbr="NCS"/><homeTeam season="2015" teamId="3800" abbr="ARI" cityState="Arizona" fullName="Arizona Cardinals" nick="Cardinals" teamType="TEAM" conferenceAbbr="NFC" divisionAbbr="NCW"/><site siteId="1907" siteCity="Glendale" siteState="AZ" siteFullname="University of Phoenix Stadium" roofType="RETRACTABLE"/><networkChannel>FOX</networkChannel></gameSchedule><gameSchedule season="2015" seasonType="REG" week="1" gameId="2015091311" gameKey="56515" gameDate="09/13/2015" gameTimeEastern="16:25:00" gameTimeLocal="16:25:00" isoTime="2015-09-13T13:25:00-07:00" homeTeamId="4900" visitorTeamId="2100" homeTeamAbbr="TB" visitorTeamAbbr="TEN" homeDisplayName="Tampa Bay Buccaneers" visitorDisplayName="Tennessee Titans" homeNickname="Buccaneers" visitorNickname="Titans" gameType="REG" weekNameAbbr="Week 1" weekName="Week 1"><visitorTeam season="2015" teamId="2100" abbr="TEN" cityState="Tennessee" fullName="Tennessee Titans" nick="Titans" teamType="TEAM" conferenceAbbr="AFC" divisionAbbr="ACS"/><homeTeam season="2015" teamId="4900" abbr="TB" cityState="Tampa Bay" fullName="Tampa Bay Buccaneers" nick="Buccaneers" teamType="TEAM" conferenceAbbr="NFC" divisionAbbr="NCS"/><site siteId="3697" siteCity="Tampa" siteState="FL" siteFullname="Raymond James Stadium" roofType="OUTDOOR"/><networkChannel>CBS</networkChannel></gameSchedule><gameSchedule season="2015" seasonType="REG" week="1" gameId="2015091310" gameKey="56514" gameDate="09/13/2015" gameTimeEastern="16:25:00" gameTimeLocal="13:25:00" isoTime="2015-09-13T13:25:00-07:00" homeTeamId="2520" visitorTeamId="0920" homeTeamAbbr="OAK" visitorTeamAbbr="CIN" homeDisplayName="Oakland Raiders" visitorDisplayName="Cincinnati Bengals" homeNickname="Raiders" visitorNickname="Bengals" gameType="REG" weekNameAbbr="Week 1" weekName="Week 1"><visitorTeam season="2015" teamId="0920" abbr="CIN" cityState="Cincinnati" fullName="Cincinnati Bengals" nick="Bengals" teamType="TEAM" conferenceAbbr="AFC" divisionAbbr="ACN"/><homeTeam season="2015" teamId="2520" abbr="OAK" cityState="Oakland" fullName="Oakland Raiders" nick="Raiders" teamType="TEAM" conferenceAbbr="AFC" divisionAbbr="ACW"/><site siteId="3225" siteCity="Oakland" siteState="CA" siteFullname="O.co Coliseum" roofType="OUTDOOR"/><networkChannel>CBS</networkChannel></gameSchedule><gameSchedule season="2015" seasonType="REG" week="1" gameId="2015091309" gameKey="56513" gameDate="09/13/2015" gameTimeEastern="16:25:00" gameTimeLocal="14:25:00" isoTime="2015-09-13T13:25:00-07:00" homeTeamId="1400" visitorTeamId="0325" homeTeamAbbr="DEN" visitorTeamAbbr="BAL" homeDisplayName="Denver Broncos" visitorDisplayName="Baltimore Ravens" homeNickname="Broncos" visitorNickname="Ravens" gameType="REG" weekNameAbbr="Week 1" weekName="Week 1"><visitorTeam season="2015" teamId="0325" abbr="BAL" cityState="Baltimore" fullName="Baltimore Ravens" nick="Ravens" teamType="TEAM" conferenceAbbr="AFC" divisionAbbr="ACN"/><homeTeam season="2015" teamId="1400" abbr="DEN" cityState="Denver" fullName="Denver Broncos" nick="Broncos" teamType="TEAM" conferenceAbbr="AFC" divisionAbbr="ACW"/><site siteId="5786" siteCity="Denver" siteState="CO" siteFullname="Sports Authority Field at Mile High" roofType="OUTDOOR"/><networkChannel>CBS</networkChannel></gameSchedule><gameSchedule season="2015" seasonType="REG" week="1" gameId="2015091312" gameKey="56516" gameDate="09/13/2015" gameTimeEastern="20:30:00" gameTimeLocal="19:30:00" isoTime="2015-09-13T17:30:00-07:00" homeTeamId="1200" visitorTeamId="3410" homeTeamAbbr="DAL" visitorTeamAbbr="NYG" homeDisplayName="Dallas Cowboys" visitorDisplayName="New York Giants" homeNickname="Cowboys" visitorNickname="Giants" gameType="REG" weekNameAbbr="Week 1" weekName="Week 1"><visitorTeam season="2015" teamId="3410" abbr="NYG" cityState="New York Giants" fullName="New York Giants" nick="Giants" teamType="TEAM" conferenceAbbr="NFC" divisionAbbr="NCE"/><homeTeam season="2015" teamId="1200" abbr="DAL" cityState="Dallas" fullName="Dallas Cowboys" nick="Cowboys" teamType="TEAM" conferenceAbbr="NFC" divisionAbbr="NCE"/><site siteId="4948" siteCity="Arlington" siteState="TX" siteFullname="AT&amp;T Stadium" roofType="RETRACTABLE"/><networkChannel>NBC</networkChannel><localAwayRadio>WFAN</localAwayRadio></gameSchedule><gameSchedule season="2015" seasonType="REG" week="1" gameId="2015091400" gameKey="56517" gameDate="09/14/2015" gameTimeEastern="19:10:00" gameTimeLocal="19:10:00" isoTime="2015-09-14T16:10:00-07:00" homeTeamId="0200" visitorTeamId="3700" homeTeamAbbr="ATL" visitorTeamAbbr="PHI" homeDisplayName="Atlanta Falcons" visitorDisplayName="Philadelphia Eagles" homeNickname="Falcons" visitorNickname="Eagles" gameType="REG" weekNameAbbr="Week 1" weekName="Week 1"><visitorTeam season="2015" teamId="3700" abbr="PHI" cityState="Philadelphia" fullName="Philadelphia Eagles" nick="Eagles" teamType="TEAM" conferenceAbbr="NFC" divisionAbbr="NCE"/><homeTeam season="2015" teamId="0200" abbr="ATL" cityState="Atlanta" fullName="Atlanta Falcons" nick="Falcons" teamType="TEAM" conferenceAbbr="NFC" divisionAbbr="NCS"/><site siteId="2053" siteCity="Atlanta" siteState="GA" siteFullname="Georgia Dome" roofType="INDOOR"/><networkChannel>ESPN</networkChannel></gameSchedule><gameSchedule season="2015" seasonType="REG" week="1" gameId="2015091401" gameKey="56518" gameDate="09/14/2015" gameTimeEastern="22:20:00" gameTimeLocal="19:20:00" isoTime="2015-09-14T19:20:00-07:00" homeTeamId="4500" visitorTeamId="3000" homeTeamAbbr="SF" visitorTeamAbbr="MIN" homeDisplayName="San Francisco 49ers" visitorDisplayName="Minnesota Vikings" homeNickname="49ers" visitorNickname="Vikings" gameType="REG" weekNameAbbr="Week 1" weekName="Week 1"><visitorTeam season="2015" teamId="3000" abbr="MIN" cityState="Minnesota" fullName="Minnesota Vikings" nick="Vikings" teamType="TEAM" conferenceAbbr="NFC" divisionAbbr="NCN"/><homeTeam season="2015" teamId="4500" abbr="SF" cityState="San Francisco" fullName="San Francisco 49ers" nick="49ers" teamType="TEAM" conferenceAbbr="NFC" divisionAbbr="NCW"/><site siteId="2099" siteCity="Santa Clara" siteState="CA" siteFullname="Levi's Stadium" roofType="OUTDOOR"/><networkChannel>ESPN</networkChannel><localHomeTv>KPIX 5</localHomeTv></gameSchedule><gameSchedule season="2015" seasonType="REG" week="2" gameId="2015091700" gameKey="56519" gameDate="09/17/2015" gameTimeEastern="20:25:00" gameTimeLocal="19:25:00" isoTime="2015-09-17T17:25:00-07:00" homeTeamId="2310" visitorTeamId="1400" homeTeamAbbr="KC" visitorTeamAbbr="DEN" homeDisplayName="Kansas City Chiefs" visitorDisplayName="Denver Broncos" homeNickname="Chiefs" visitorNickname="Broncos" gameType="REG" weekNameAbbr="Week 2" weekName="Week 2"><visitorTeam season="2015" teamId="1400" abbr="DEN" cityState="Denver" fullName="Denver Broncos" nick="Broncos" teamType="TEAM" conferenceAbbr="AFC" divisionAbbr="ACW"/><homeTeam season="2015" teamId="2310" abbr="KC" cityState="Kansas City" fullName="Kansas City Chiefs" nick="Chiefs" teamType="TEAM" conferenceAbbr="AFC" divisionAbbr="ACW"/><site siteId="1552" siteCity="Kansas City" siteState="MO" siteFullname="Arrowhead Stadium" roofType="OUTDOOR"/><networkChannel>CBS</networkChannel><networkChannel2>NFL NETWORK</networkChannel2></gameSchedule><gameSchedule season="2015" seasonType="REG" week="2" gameId="2015092000" gameKey="56521" gameDate="09/20/2015" gameTimeEastern="13:00:00" gameTimeLocal="13:00:00" isoTime="2015-09-20T10:00:00-07:00" homeTeamId="0750" visitorTeamId="2120" homeTeamAbbr="CAR" visitorTeamAbbr="HOU" homeDisplayName="Carolina Panthers" visitorDisplayName="Houston Texans" homeNickname="Panthers" visitorNickname="Texans" gameType="REG" weekNameAbbr="Week 2" weekName="Week 2"><visitorTeam season="2015" teamId="2120" abbr="HOU" cityState="Houston" fullName="Houston Texans" nick="Texans" teamType="TEAM" conferenceAbbr="AFC" divisionAbbr="ACS"/><homeTeam season="2015" teamId="0750" abbr="CAR" cityState="Carolina" fullName="Carolina Panthers" nick="Panthers" teamType="TEAM" conferenceAbbr="NFC" divisionAbbr="NCS"/><site siteId="1769" siteCity="Charlotte" siteState="NC" siteFullname="Bank of America Stadium" roofType="OUTDOOR"/><networkChannel>CBS</networkChannel></gameSchedule><gameSchedule season="2015" seasonType="REG" week="2" gameId="2015092009" gameKey="56528" gameDate="09/20/2015" gameTimeEastern="13:00:00" gameTimeLocal="13:00:00" isoTime="2015-09-20T10:00:00-07:00" homeTeamId="3900" visitorTeamId="4500" homeTeamAbbr="PIT" visitorTeamAbbr="SF" homeDisplayName="Pittsburgh Steelers" visitorDisplayName="San Francisco 49ers" homeNickname="Steelers" visitorNickname="49ers" gameType="REG" weekNameAbbr="Week 2" weekName="Week 2"><visitorTeam season="2015" teamId="4500" abbr="SF" cityState="San Francisco" fullName="San Francisco 49ers" nick="49ers" teamType="TEAM" conferenceAbbr="NFC" divisionAbbr="NCW"/><homeTeam season="2015" teamId="3900" abbr="PIT" cityState="Pittsburgh" fullName="Pittsburgh Steelers" nick="Steelers" teamType="TEAM" conferenceAbbr="AFC" divisionAbbr="ACN"/><site siteId="5411" siteCity="Pittsburgh" siteState="PA" siteFullname="Heinz Field" roofType="OUTDOOR"/><networkChannel>FOX</networkChannel><localAwayTv>KPIX 5</localAwayTv></gameSchedule><gameSchedule season="2015" seasonType="REG" week="2" gameId="2015092008" gameKey="56526" gameDate="09/20/2015" gameTimeEastern="13:00:00" gameTimeLocal="12:00:00" isoTime="2015-09-20T10:00:00-07:00" homeTeamId="3300" visitorTeamId="4900" homeTeamAbbr="NO" visitorTeamAbbr="TB" homeDisplayName="New Orleans Saints" visitorDisplayName="Tampa Bay Buccaneers" homeNickname="Saints" visitorNickname="Buccaneers" gameType="REG" weekNameAbbr="Week 2" weekName="Week 2"><visitorTeam season="2015" teamId="4900" abbr="TB" cityState="Tampa Bay" fullName="Tampa Bay Buccaneers" nick="Buccaneers" teamType="TEAM" conferenceAbbr="NFC" divisionAbbr="NCS"/><homeTeam season="2015" teamId="3300" abbr="NO" cityState="New Orleans" fullName="New Orleans Saints" nick="Saints" teamType="TEAM" conferenceAbbr="NFC" divisionAbbr="NCS"/><site siteId="2870" siteCity="New Orleans" siteState="LA" siteFullname="Mercedes-Benz Superdome" roofType="INDOOR"/><networkChannel>FOX</networkChannel></gameSchedule><gameSchedule season="2015" seasonType="REG" week="2" gameId="2015092007" gameKey="56525" gameDate="09/20/2015" gameTimeEastern="13:00:00" gameTimeLocal="12:00:00" isoTime="2015-09-20T10:00:00-07:00" homeTeamId="3000" visitorTeamId="1540" homeTeamAbbr="MIN" visitorTeamAbbr="DET" homeDisplayName="Minnesota Vikings" visitorDisplayName="Detroit Lions" homeNickname="Vikings" visitorNickname="Lions" gameType="REG" weekNameAbbr="Week 2" weekName="Week 2"><visitorTeam season="2015" teamId="1540" abbr="DET" cityState="Detroit" fullName="Detroit Lions" nick="Lions" teamType="TEAM" conferenceAbbr="NFC" divisionAbbr="NCN"/><homeTeam season="2015" teamId="3000" abbr="MIN" cityState="Minnesota" fullName="Minnesota Vikings" nick="Vikings" teamType="TEAM" conferenceAbbr="NFC" divisionAbbr="NCN"/><site siteId="5606" siteCity="Minneapolis" siteState="MN" siteFullname="TCF Bank Stadium" roofType="OUTDOOR"/><networkChannel>FOX</networkChannel></gameSchedule><gameSchedule season="2015" seasonType="REG" week="2" gameId="2015092001" gameKey="56520" gameDate="09/20/2015" gameTimeEastern="13:00:00" gameTimeLocal="13:00:00" isoTime="2015-09-20T10:00:00-07:00" homeTeamId="0610" visitorTeamId="3200" homeTeamAbbr="BUF" visitorTeamAbbr="NE" homeDisplayName="Buffalo Bills" visitorDisplayName="New England Patriots" homeNickname="Bills" visitorNickname="Patriots" gameType="REG" weekNameAbbr="Week 2" weekName="Week 2"><visitorTeam season="2015" teamId="3200" abbr="NE" cityState="New England" fullName="New England Patriots" nick="Patriots" teamType="TEAM" conferenceAbbr="AFC" divisionAbbr="ACE"/><homeTeam season="2015" teamId="0610" abbr="BUF" cityState="Buffalo" fullName="Buffalo Bills" nick="Bills" teamType="TEAM" conferenceAbbr="AFC" divisionAbbr="ACE"/><site siteId="3770" siteCity="Orchard Park" siteState="NY" siteFullname="Ralph Wilson Stadium" roofType="OUTDOOR"/><networkChannel>CBS</networkChannel><localAwayTv>/ WBZ</localAwayTv><localAwayRadio>98.5 FM The Sports Hub</localAwayRadio></gameSchedule><gameSchedule season="2015" seasonType="REG" week="2" gameId="2015092002" gameKey="56523" gameDate="09/20/2015" gameTimeEastern="13:00:00" gameTimeLocal="13:00:00" isoTime="2015-09-20T10:00:00-07:00" homeTeamId="0920" visitorTeamId="4400" homeTeamAbbr="CIN" visitorTeamAbbr="SD" homeDisplayName="Cincinnati Bengals" visitorDisplayName="San Diego Chargers" homeNickname="Bengals" visitorNickname="Chargers" gameType="REG" weekNameAbbr="Week 2" weekName="Week 2"><visitorTeam season="2015" teamId="4400" abbr="SD" cityState="San Diego" fullName="San Diego Chargers" nick="Chargers" teamType="TEAM" conferenceAbbr="AFC" divisionAbbr="ACW"/><homeTeam season="2015" teamId="0920" abbr="CIN" cityState="Cincinnati" fullName="Cincinnati Bengals" nick="Bengals" teamType="TEAM" conferenceAbbr="AFC" divisionAbbr="ACN"/><site siteId="3530" siteCity="Cincinnati" siteState="OH" siteFullname="Paul Brown Stadium" roofType="OUTDOOR"/><networkChannel>CBS</networkChannel><localAwayRadio>ROCK 105.3</localAwayRadio></gameSchedule><gameSchedule season="2015" seasonType="REG" week="2" gameId="2015092003" gameKey="56524" gameDate="09/20/2015" gameTimeEastern="13:00:00" gameTimeLocal="13:00:00" isoTime="2015-09-20T10:00:00-07:00" homeTeamId="1050" visitorTeamId="2100" homeTeamAbbr="CLE" visitorTeamAbbr="TEN" homeDisplayName="Cleveland Browns" visitorDisplayName="Tennessee Titans" homeNickname="Browns" visitorNickname="Titans" gameType="REG" weekNameAbbr="Week 2" weekName="Week 2"><visitorTeam season="2015" teamId="2100" abbr="TEN" cityState="Tennessee" fullName="Tennessee Titans" nick="Titans" teamType="TEAM" conferenceAbbr="AFC" divisionAbbr="ACS"/><homeTeam season="2015" teamId="1050" abbr="CLE" cityState="Cleveland" fullName="Cleveland Browns" nick="Browns" teamType="TEAM" conferenceAbbr="AFC" divisionAbbr="ACN"/><site siteId="1048" siteCity="Cleveland" siteState="OH" siteFullname="FirstEnergy Stadium" roofType="OUTDOOR"/><networkChannel>CBS</networkChannel></gameSchedule><gameSchedule season="2015" seasonType="REG" week="2" gameId="2015092004" gameKey="56527" gameDate="09/20/2015" gameTimeEastern="13:00:00" gameTimeLocal="13:00:00" isoTime="2015-09-20T10:00:00-07:00" homeTeamId="3410" visitorTeamId="0200" homeTeamAbbr="NYG" visitorTeamAbbr="ATL" homeDisplayName="New York Giants" visitorDisplayName="Atlanta Falcons" homeNickname="Giants" visitorNickname="Falcons" gameType="REG" weekNameAbbr="Week 2" weekName="Week 2"><visitorTeam season="2015" teamId="0200" abbr="ATL" cityState="Atlanta" fullName="Atlanta Falcons" nick="Falcons" teamType="TEAM" conferenceAbbr="NFC" divisionAbbr="NCS"/><homeTeam season="2015" teamId="3410" abbr="NYG" cityState="New York Giants" fullName="New York Giants" nick="Giants" teamType="TEAM" conferenceAbbr="NFC" divisionAbbr="NCE"/><site siteId="3757" siteCity="East Rutherford" siteState="NJ" siteFullname="MetLife Stadium" roofType="OUTDOOR"/><networkChannel>FOX</networkChannel><localHomeRadio>WFAN</localHomeRadio></gameSchedule><gameSchedule season="2015" seasonType="REG" week="2" gameId="2015092005" gameKey="56529" gameDate="09/20/2015" gameTimeEastern="13:00:00" gameTimeLocal="13:00:00" isoTime="2015-09-20T10:00:00-07:00" homeTeamId="5110" visitorTeamId="2510" homeTeamAbbr="WAS" visitorTeamAbbr="STL" homeDisplayName="Washington Redskins" visitorDisplayName="St. Louis Rams" homeNickname="Redskins" visitorNickname="Rams" gameType="REG" weekNameAbbr="Week 2" weekName="Week 2"><visitorTeam season="2015" teamId="2510" abbr="STL" cityState="St. Louis" fullName="St. Louis Rams" nick="Rams" teamType="TEAM" conferenceAbbr="NFC" divisionAbbr="NCW"/><homeTeam season="2015" teamId="5110" abbr="WAS" cityState="Washington" fullName="Washington Redskins" nick="Redskins" teamType="TEAM" conferenceAbbr="NFC" divisionAbbr="NCE"/><site siteId="2389" siteCity="Landover" siteState="MD" siteFullname="FedExField" roofType="OUTDOOR"/><networkChannel>FOX</networkChannel><localHomeTv>FOX</localHomeTv></gameSchedule><gameSchedule season="2015" seasonType="REG" week="2" gameId="2015092006" gameKey="56522" gameDate="09/20/2015" gameTimeEastern="13:00:00" gameTimeLocal="12:00:00" isoTime="2015-09-20T10:00:00-07:00" homeTeamId="0810" visitorTeamId="3800" homeTeamAbbr="CHI" visitorTeamAbbr="ARI" homeDisplayName="Chicago Bears" visitorDisplayName="Arizona Cardinals" homeNickname="Bears" visitorNickname="Cardinals" gameType="REG" weekNameAbbr="Week 2" weekName="Week 2"><visitorTeam season="2015" teamId="3800" abbr="ARI" cityState="Arizona" fullName="Arizona Cardinals" nick="Cardinals" teamType="TEAM" conferenceAbbr="NFC" divisionAbbr="NCW"/><homeTeam season="2015" teamId="0810" abbr="CHI" cityState="Chicago" fullName="Chicago Bears" nick="Bears" teamType="TEAM" conferenceAbbr="NFC" divisionAbbr="NCN"/><site siteId="4620" siteCity="Chicago" siteState="IL" siteFullname="Soldier Field" roofType="OUTDOOR"/><networkChannel>FOX</networkChannel><localHomeRadio>WBBM (English) | TBA (Español)</localHomeRadio></gameSchedule><gameSchedule season="2015" seasonType="REG" week="2" gameId="2015092011" gameKey="56530" gameDate="09/20/2015" gameTimeEastern="16:05:00" gameTimeLocal="16:05:00" isoTime="2015-09-20T13:05:00-07:00" homeTeamId="2250" visitorTeamId="2700" homeTeamAbbr="JAC" visitorTeamAbbr="MIA" homeDisplayName="Jacksonville Jaguars" visitorDisplayName="Miami Dolphins" homeNickname="Jaguars" visitorNickname="Dolphins" gameType="REG" weekNameAbbr="Week 2" weekName="Week 2"><visitorTeam season="2015" teamId="2700" abbr="MIA" cityState="Miami" fullName="Miami Dolphins" nick="Dolphins" teamType="TEAM" conferenceAbbr="AFC" divisionAbbr="ACE"/><homeTeam season="2015" teamId="2250" abbr="JAC" cityState="Jacksonville" fullName="Jacksonville Jaguars" nick="Jaguars" teamType="TEAM" conferenceAbbr="AFC" divisionAbbr="ACS"/><site siteId="2049" siteCity="Jacksonville" siteState="FL" siteFullname="EverBank Field" roofType="OUTDOOR"/><networkChannel>CBS</networkChannel></gameSchedule><gameSchedule season="2015" seasonType="REG" week="2" gameId="2015092010" gameKey="56531" gameDate="09/20/2015" gameTimeEastern="16:05:00" gameTimeLocal="13:05:00" isoTime="2015-09-20T13:05:00-07:00" homeTeamId="2520" visitorTeamId="0325" homeTeamAbbr="OAK" visitorTeamAbbr="BAL" homeDisplayName="Oakland Raiders" visitorDisplayName="Baltimore Ravens" homeNickname="Raiders" visitorNickname="Ravens" gameType="REG" weekNameAbbr="Week 2" weekName="Week 2"><visitorTeam season="2015" teamId="0325" abbr="BAL" cityState="Baltimore" fullName="Baltimore Ravens" nick="Ravens" teamType="TEAM" conferenceAbbr="AFC" divisionAbbr="ACN"/><homeTeam season="2015" teamId="2520" abbr="OAK" cityState="Oakland" fullName="Oakland Raiders" nick="Raiders" teamType="TEAM" conferenceAbbr="AFC" divisionAbbr="ACW"/><site siteId="3225" siteCity="Oakland" siteState="CA" siteFullname="O.co Coliseum" roofType="OUTDOOR"/><networkChannel>CBS</networkChannel></gameSchedule><gameSchedule season="2015" seasonType="REG" week="2" gameId="2015092012" gameKey="56532" gameDate="09/20/2015" gameTimeEastern="16:25:00" gameTimeLocal="16:25:00" isoTime="2015-09-20T13:25:00-07:00" homeTeamId="3700" visitorTeamId="1200" homeTeamAbbr="PHI" visitorTeamAbbr="DAL" homeDisplayName="Philadelphia Eagles" visitorDisplayName="Dallas Cowboys" homeNickname="Eagles" visitorNickname="Cowboys" gameType="REG" weekNameAbbr="Week 2" weekName="Week 2"><visitorTeam season="2015" teamId="1200" abbr="DAL" cityState="Dallas" fullName="Dallas Cowboys" nick="Cowboys" teamType="TEAM" conferenceAbbr="NFC" divisionAbbr="NCE"/><homeTeam season="2015" teamId="3700" abbr="PHI" cityState="Philadelphia" fullName="Philadelphia Eagles" nick="Eagles" teamType="TEAM" conferenceAbbr="NFC" divisionAbbr="NCE"/><site siteId="2769" siteCity="Philadelphia" siteState="PA" siteFullname="Lincoln Financial Field" roofType="OUTDOOR"/><networkChannel>FOX</networkChannel></gameSchedule><gameSchedule season="2015" seasonType="REG" week="2" gameId="2015092013" gameKey="56533" gameDate="09/20/2015" gameTimeEastern="20:30:00" gameTimeLocal="19:30:00" isoTime="2015-09-20T17:30:00-07:00" homeTeamId="1800" visitorTeamId="4600" homeTeamAbbr="GB" visitorTeamAbbr="SEA" homeDisplayName="Green Bay Packers" visitorDisplayName="Seattle Seahawks" homeNickname="Packers" visitorNickname="Seahawks" gameType="REG" weekNameAbbr="Week 2" weekName="Week 2"><visitorTeam season="2015" teamId="4600" abbr="SEA" cityState="Seattle" fullName="Seattle Seahawks" nick="Seahawks" teamType="TEAM" conferenceAbbr="NFC" divisionAbbr="NCW"/><homeTeam season="2015" teamId="1800" abbr="GB" cityState="Green Bay" fullName="Green Bay Packers" nick="Packers" teamType="TEAM" conferenceAbbr="NFC" divisionAbbr="NCN"/><site siteId="2606" siteCity="Green Bay" siteState="WI" siteFullname="Lambeau Field" roofType="OUTDOOR"/><networkChannel>NBC</networkChannel><radioSatelliteHome>81</radioSatelliteHome></gameSchedule><gameSchedule season="2015" seasonType="REG" week="2" gameId="2015092100" gameKey="56534" gameDate="09/21/2015" gameTimeEastern="20:30:00" gameTimeLocal="20:30:00" isoTime="2015-09-21T17:30:00-07:00" homeTeamId="2200" visitorTeamId="3430" homeTeamAbbr="IND" visitorTeamAbbr="NYJ" homeDisplayName="Indianapolis Colts" visitorDisplayName="New York Jets" homeNickname="Colts" visitorNickname="Jets" gameType="REG" weekNameAbbr="Week 2" weekName="Week 2"><visitorTeam season="2015" teamId="3430" abbr="NYJ" cityState="New York Jets" fullName="New York Jets" nick="Jets" teamType="TEAM" conferenceAbbr="AFC" divisionAbbr="ACE"/><homeTeam season="2015" teamId="2200" abbr="IND" cityState="Indianapolis" fullName="Indianapolis Colts" nick="Colts" teamType="TEAM" conferenceAbbr="AFC" divisionAbbr="ACS"/><site siteId="2878" siteCity="Indianapolis" siteState="IN" siteFullname="Lucas Oil Stadium" roofType="INDOOR"/><networkChannel>ESPN</networkChannel></gameSchedule><gameSchedule season="2015" seasonType="REG" week="3" gameId="2015092400" gameKey="56535" gameDate="09/24/2015" gameTimeEastern="20:25:00" gameTimeLocal="20:25:00" isoTime="2015-09-24T17:25:00-07:00" homeTeamId="3410" visitorTeamId="5110" homeTeamAbbr="NYG" visitorTeamAbbr="WAS" homeDisplayName="New York Giants" visitorDisplayName="Washington Redskins" homeNickname="Giants" visitorNickname="Redskins" gameType="REG" weekNameAbbr="Week 3" weekName="Week 3"><visitorTeam season="2015" teamId="5110" abbr="WAS" cityState="Washington" fullName="Washington Redskins" nick="Redskins" teamType="TEAM" conferenceAbbr="NFC" divisionAbbr="NCE"/><homeTeam season="2015" teamId="3410" abbr="NYG" cityState="New York Giants" fullName="New York Giants" nick="Giants" teamType="TEAM" conferenceAbbr="NFC" divisionAbbr="NCE"/><site siteId="3757" siteCity="East Rutherford" siteState="NJ" siteFullname="MetLife Stadium" roofType="OUTDOOR"/><networkChannel>CBS</networkChannel><networkChannel2>NFL NETWORK</networkChannel2><localAwayTv>CBS / NFLN</localAwayTv><localHomeRadio>WCBS 880</localHomeRadio></gameSchedule><gameSchedule season="2015" seasonType="REG" week="3" gameId="2015092700" gameKey="56539" gameDate="09/27/2015" gameTimeEastern="13:00:00" gameTimeLocal="12:00:00" isoTime="2015-09-27T10:00:00-07:00" homeTeamId="1200" visitorTeamId="0200" homeTeamAbbr="DAL" visitorTeamAbbr="ATL" homeDisplayName="Dallas Cowboys" visitorDisplayName="Atlanta Falcons" homeNickname="Cowboys" visitorNickname="Falcons" gameType="REG" weekNameAbbr="Week 3" weekName="Week 3"><visitorTeam season="2015" teamId="0200" abbr="ATL" cityState="Atlanta" fullName="Atlanta Falcons" nick="Falcons" teamType="TEAM" conferenceAbbr="NFC" divisionAbbr="NCS"/><homeTeam season="2015" teamId="1200" abbr="DAL" cityState="Dallas" fullName="Dallas Cowboys" nick="Cowboys" teamType="TEAM" conferenceAbbr="NFC" divisionAbbr="NCE"/><site siteId="4948" siteCity="Arlington" siteState="TX" siteFullname="AT&amp;T Stadium" roofType="RETRACTABLE"/><networkChannel>FOX</networkChannel></gameSchedule><gameSchedule season="2015" seasonType="REG" week="3" gameId="2015092709" gameKey="56545" gameDate="09/27/2015" gameTimeEastern="13:00:00" gameTimeLocal="12:00:00" isoTime="2015-09-27T10:00:00-07:00" homeTeamId="2100" visitorTeamId="2200" homeTeamAbbr="TEN" visitorTeamAbbr="IND" homeDisplayName="Tennessee Titans" visitorDisplayName="Indianapolis Colts" homeNickname="Titans" visitorNickname="Colts" gameType="REG" weekNameAbbr="Week 3" weekName="Week 3"><visitorTeam season="2015" teamId="2200" abbr="IND" cityState="Indianapolis" fullName="Indianapolis Colts" nick="Colts" teamType="TEAM" conferenceAbbr="AFC" divisionAbbr="ACS"/><homeTeam season="2015" teamId="2100" abbr="TEN" cityState="Tennessee" fullName="Tennessee Titans" nick="Titans" teamType="TEAM" conferenceAbbr="AFC" divisionAbbr="ACS"/><site siteId="2350" siteCity="Nashville" siteState="TN" siteFullname="Nissan Stadium" roofType="OUTDOOR"/><networkChannel>CBS</networkChannel></gameSchedule><gameSchedule season="2015" seasonType="REG" week="3" gameId="2015092708" gameKey="56538" gameDate="09/27/2015" gameTimeEastern="13:00:00" gameTimeLocal="13:00:00" isoTime="2015-09-27T10:00:00-07:00" homeTeamId="1050" visitorTeamId="2520" homeTeamAbbr="CLE" visitorTeamAbbr="OAK" homeDisplayName="Cleveland Browns" visitorDisplayName="Oakland Raiders" homeNickname="Browns" visitorNickname="Raiders" gameType="REG" weekNameAbbr="Week 3" weekName="Week 3"><visitorTeam season="2015" teamId="2520" abbr="OAK" cityState="Oakland" fullName="Oakland Raiders" nick="Raiders" teamType="TEAM" conferenceAbbr="AFC" divisionAbbr="ACW"/><homeTeam season="2015" teamId="1050" abbr="CLE" cityState="Cleveland" fullName="Cleveland Browns" nick="Browns" teamType="TEAM" conferenceAbbr="AFC" divisionAbbr="ACN"/><site siteId="1048" siteCity="Cleveland" siteState="OH" siteFullname="FirstEnergy Stadium" roofType="OUTDOOR"/><networkChannel>CBS</networkChannel></gameSchedule><gameSchedule season="2015" seasonType="REG" week="3" gameId="2015092707" gameKey="56536" gameDate="09/27/2015" gameTimeEastern="13:00:00" gameTimeLocal="13:00:00" isoTime="2015-09-27T10:00:00-07:00" homeTeamId="0325" visitorTeamId="0920" homeTeamAbbr="BAL" visitorTeamAbbr="CIN" homeDisplayName="Baltimore Ravens" visitorDisplayName="Cincinnati Bengals" homeNickname="Ravens" visitorNickname="Bengals" gameType="REG" weekNameAbbr="Week 3" weekName="Week 3"><visitorTeam season="2015" teamId="0920" abbr="CIN" cityState="Cincinnati" fullName="Cincinnati Bengals" nick="Bengals" teamType="TEAM" conferenceAbbr="AFC" divisionAbbr="ACN"/><homeTeam season="2015" teamId="0325" abbr="BAL" cityState="Baltimore" fullName="Baltimore Ravens" nick="Ravens" teamType="TEAM" conferenceAbbr="AFC" divisionAbbr="ACN"/><site siteId="3695" siteCity="Baltimore" siteState="MD" siteFullname="M&amp;T Bank Stadium" roofType="OUTDOOR"/><networkChannel>CBS</networkChannel></gameSchedule><gameSchedule season="2015" seasonType="REG" week="3" gameId="2015092706" gameKey="56542" gameDate="09/27/2015" gameTimeEastern="13:00:00" gameTimeLocal="13:00:00" isoTime="2015-09-27T10:00:00-07:00" homeTeamId="3200" visitorTeamId="2250" homeTeamAbbr="NE" visitorTeamAbbr="JAC" homeDisplayName="New England Patriots" visitorDisplayName="Jacksonville Jaguars" homeNickname="Patriots" visitorNickname="Jaguars" gameType="REG" weekNameAbbr="Week 3" weekName="Week 3"><visitorTeam season="2015" teamId="2250" abbr="JAC" cityState="Jacksonville" fullName="Jacksonville Jaguars" nick="Jaguars" teamType="TEAM" conferenceAbbr="AFC" divisionAbbr="ACS"/><homeTeam season="2015" teamId="3200